title,episodes,mark,score,is_finish,link,series_follow,follows,coins,likes,danmus,views,season_id,media_id,tags,comments,pub_date,intro
网球优等生 第二期,25,0,9.5,1,https://www.bilibili.com/bangumi/play/ss1652,32739,14267,1262,522,7622,573122,1652,1652,['运动'],329.0,2015/4/5,作品主要讲述了学习十分认真刻苦的男高中生丸尾荣一郎，为了解决自身运动不足的问题而参加了STC(南网球俱乐部)的免费体验。在那里遇到了之前借笔记的隔壁班的鹰崎奈津，通过与她的对话，荣一郎正式开始练习打网球。慢慢地，他不仅喜欢上了网球，而且也更加了解网球。
EVA 新世纪福音战士剧场版：死与新生,1,0,9.5,1,https://www.bilibili.com/bangumi/play/ss1637?theme=movie,1726869,223441,12502,8464,22601,3989105,1637,10312,"['科幻', '机战', '战斗']",1813.0,1997/3/15,《EVA 新世纪福音战士剧场版：DEATH AND REBIRTH》，为剧场版系列的第一部。分为“DEATH篇”与“REBIRTH篇”两个部分。“死亡篇”是以TV版动画1-24话的内容为基础，重新剪辑的总集篇。“REBIRTH篇”则承接24话之后的内容：第十七使徒被消灭后，SEELE向NERV下达命令，要EVA初号机执行“人类补完计划”。然而碇元度不认同SEELE的做法，拒绝执行命令。SEELE认定这是一种叛变行为，决定彻底消灭NERV。破晓时分，NERV本部突然遭到来自战略自卫队的袭击，为了保护驾驶员，葛城美里将精神崩溃的明日香送上二号机，自已亲自去救碇真嗣 。但此时的真嗣已...
灼眼的夏娜S,4,0,9.5,1,https://www.bilibili.com/bangumi/play/ss1605,1322438,169042,5067,1751,56384,1410096,1605,1605,"['校园', '战斗', '热血', '小说改']",560.0,2009/10/23,夏娜和悠二为了寻找红世之王法利亚格尼所留下的宝具，来到了某栋废弃的百货大楼。当两人还在堆积如山的玩具中苦寻不获时，他们还不知道悠二偶然捡到的望远镜就是所要寻找的宝具。由于宝具的力量，夏娜和悠二的意识通过宝具转移到了对方的身体中......
摸索吧！部活剧,12,0,9.5,1,https://www.bilibili.com/bangumi/play/ss1578,59760,48818,639,644,3777,300351,1578,1578,"['日常', '社团']",227.0,2013/10/5,"平凡的高中,平凡的部员们.""我的特点""是什么?""我的归处""又是什么?少女们为了探究这些暧昧的问题,为了实现""不太一样的高中生活""而奋斗,并一点点地成熟起来.充满现实感的青春高中社团活动喜剧从此开始！摸索吧！部活剧是使用CG软件Miku Miku Dance（MMD）制作的动画，监督和脚本也是参与了上述两部作品的石舘光太郎，由他最新打造的以“部活”（社团活动）为主题的动画作品。"
攻壳机动队 S.A.C. SSS 3D,1,0,9.5,1,https://www.bilibili.com/bangumi/play/ss1566?theme=movie,919286,91986,1345,612,7271,707763,1566,1566,"['科幻', '热血', '智斗']",341.0,2011/3/26,《攻壳机动队》，是由日本漫画家士郎正宗1989年4月22日首次连载于讲谈社青年漫画月刊《Young Magazine海贼版》的漫画，进度为每三个月一话，第一部总共收录有12话，在结束了第一部以后正式开始了第二部的连载，于1991年10月5日以一千日元的高价（相对同期的其他漫画而言）第一次印刷发行攻壳机动队第一部漫画的单行本。《攻壳机动队》还被改编为电视动画、动画电影。 单行本中充满注解，比漫画还多。人物性格大多很轻松。作者的话中说道：“对于默默不断前进的科学，SF（科幻）也总不能总是描写世纪末的倦怠世界吧。未来还是明亮的好。” 英语...
我的女神 小不隆咚便利多多,48,0,9.5,1,https://www.bilibili.com/bangumi/play/ss1450,225308,11811,439,208,2897,183238,1450,1450,"['时泪', '治愈', '奇幻']",107.0,1998/4/6,1998年4月6日～1999年3月29日，在WOWOW的ANIME COMPLEX频道放映，全48话。本作品在漫画中以外传形式刊载，主要人物为乌璐德、斯库璐特、阿岩，萤一与贝露丹蒂不常出现。第1至13话中，由于配贝露丹蒂的井上喜久子休产假的关系，所以由冈村明美代为配音。香港无线电视播映时定名《迷你爱神》。台湾地区由木棉花国际代理，台湾电视公司首播。
奇幻贵公子,25,0,9.5,1,https://www.bilibili.com/bangumi/play/ss1406,221233,221233,5776,3185,91106,2952338,1406,1406,"['奇幻', '推理']",1834.0,2006/10/3,普通的女高中生谷山麻衣和自恋的美少年涩谷一也，与各式各样的灵能者挑战怪事件的系列。少女小说家小野不由美的成名作。长达5年的长寿系列，直到现在仍受广大年龄层的支持。当时的少女小说，有着“必须使用主角的第一人称描写”、“主角必须是普通的女孩子”、“必须是恋爱小说”等不成文的规定，但是小野不由美却使用第三人称描写出神秘、恐怖的一面。
物怪,26,0,9.5,1,https://www.bilibili.com/bangumi/play/ss1349,33255,33255,524,412,5773,234302,1349,1349,"['奇幻', '日常', '治愈']",142.0,2007/10/2,不知怎样培育这两个孩子的家庭，决定把他们托付给乡下的祖父母。在乡村平静的生活中，两姐妹从祖父母还有村民那里学习了与妖怪以及自然共存的重要意义，还理解了过去的人们尊重鬼神、敬畏自然的想法，通过植根于乡村生活中的风俗习惯掌握了现代人早已忘记的“珍贵的东西”。
素描簿,13,0,9.5,1,https://www.bilibili.com/bangumi/play/ss1344,42827,42827,782,271,6382,226718,1344,1344,"['萌系', '日常', '治愈']",243.0,2007/10/1,《素描本》的主角是个无口天然呆娘，喜欢散步、猫还有素描。整部作品描写了主角学校中美术部的生活。学校的后山，悠然自得的写生大会，上学路上的小猫，放学后的美术室，有点“抽”的先辈们，偶然间的灵光闪现，彩虹，烟火，夜间的烧烤……就这样点点滴滴，零零碎碎的学校琐事钩织成了《素描本》的故事……
魔人侦探食脑奈罗,25,0,9.5,1,https://www.bilibili.com/bangumi/play/ss1331,65553,65553,1473,128,30498,1065849,1331,1331,"['奇幻', '推理']",511.0,2007/10/2,“谜”所指的就是谜团，在充满恶意（小至恶作剧，大至恨意）的谜团（谋杀事件）解开之时，会释放出大量的能量。主角——魔界的变种生物脑啮涅罗，就是专门吃“谜”为生的魔界异种生物，在吃完了魔界的“谜”之后，来到人间寻找最极致的“谜”。在他刚到人间时正巧遇到因为父亲遭到杀害，而失魂落魄的女主角弥子，于是便露出真面目强迫弥子当她的代理人，并借着弥子的手顺利的解开了数个事件。由于涅罗凭着对于“谜”的敏锐直觉使弥子成为了著名的大侦探，两个人于是成立了一间侦探事务所，共同寻找极致的“谜”。魔人探侦脳噛ネウロ是由日本漫...
彩云国物语 第二季,39,0,9.5,1,https://www.bilibili.com/bangumi/play/ss1300,221808,63123,1642,861,25443,1537718,1300,1300,"['奇幻', '少女', '声控', '小说改']",360.0,2007/4/7,在第二季中，秀丽成为了新人官员之后，得到了身边许多人的帮助。就在一切都步入正轨、顺利发展的时候，一位拥有特殊能力的缥家的族人来到了彩云国，一场不为人知的阴谋也随之悄悄降临。秀丽是否能识破其中的一切呢？在经历了种种挫折与分离之后，她依然还能坚持当初的初衷，为民尽力吗？
彩云国物语,39,0,9.5,1,https://www.bilibili.com/bangumi/play/ss1299,221808,210460,5513,3145,80074,2751669,1299,1299,"['奇幻', '少女', '声控', '小说改']",1007.0,2006/4/8,故事的舞台设定在某个中国风的虚构国家——彩云国。虽是名门却家道中落的红家小姐秀丽，因为小时候对动乱的记忆而想要成为“能够帮助人们”的官吏，但身为女性的她无法参加官员的录用考试。某一天，秀丽突然被引荐去做新登基的皇帝的教师，以此为契机，她打通了通向官员录用考试的道路，成为了一名正式官员。秀丽与新王的恋情、与同僚的友情，温馨的故事中隐藏着宫廷权力的斗争与豪门中涌动的暗流，绚烂华丽的宫廷浪漫剧逐渐展开……
蓝龙,50,0,9.5,1,https://www.bilibili.com/bangumi/play/ss1281,21624,21624,767,845,5722,357724,1281,1281,"['奇幻', '少儿', '热血']",204.0,2007/4/7,在遥远的过去，有着光与黑暗的战斗。然后在那场战斗中，有七位叫作光之战士的人们以他们的力量封印了黑暗而结束战争。那个故事最后也成为神话，他们所持的影之力也被他们的后裔秘密地继承著。 然后有位戈鲁昂帝国之王，奈那发现自己的影之力，为了征服世界，而展开杀戮和破坏。而同样拥有影之力的左拉为了阻止他的野心，于是与七名光之战士的末裔吉罗一起找寻剩下的末裔。 在塔塔村中则有着两位每天过著和平日子，希望成为骑士王的修和青梅竹马克露克。他们所住的地方也遭到鲁昂帝国的攻击。在战斗当中，修的影兽“蓝龙”也逐渐苏醒过来。 ...
Stories?of?Last?Letter,13,0,9.5,1,https://www.bilibili.com/bangumi/play/ss1262,212252,212252,5481,3516,31272,1705917,1262,1262,"['奇幻', '治愈', '少女']",1604.0,2008/1/5,文伽是一位身着日本旧式邮政工作制服、手持不可思议手杖的无口少女，在她黑色的工作包中装满了贴着黑色邮票的信件。那并不是普通的信，而是已经过世了的人写给重要的人的信——死后文。少女与作为同伴的手杖“卡娜卡”一起往返于冥界与生界，传递跨越了生死的依恋。
超时空要塞 Frontier,25,0,9.5,1,https://www.bilibili.com/bangumi/play/ss1189,198787,186758,4093,1302,99593,3475832,1189,1189,"['科幻', '热血', '机战', '偶像']",1427.0,2008/4/3,A.D.1999，由坠落地球的“谜之战舰”(之后被称之为Macross)带来的Over Technology(オーバーテクノロジー)，揭示了人类历史和远古文明 Proto Culture (プロトカルチャー)之间的丝丝联系。促使人类终止彼此间的战争，一方面面对强大的异星人势力 Zentraedi(ゼントラーディ)和Proto Deviln(プロトデビルン)，用“文化的力量”寻找生存之道，一方面向着银河系进行移民而寻求新天地。最初的Macross，被看作改变了地球宇宙历史的“命运之船”！BigWest(ビックウエスト)制作，Studio Nue(スタジオぬえ)原作之Anime。1982年初代“超时空要塞Macross”(...
超时空要塞 Macross,36,0,9.5,1,https://www.bilibili.com/bangumi/play/ss1187,115894,103411,1981,1096,66774,1727169,1187,1187,"['科幻', '热血', '机战', '偶像']",503.0,1982/10/3,A.D.1999，由坠落地球的“谜之战舰”(之后被称之为Macross)带来的Over Technology(オーバーテクノロジー)，揭示了人类历史和远古文明 Proto Culture (プロトカルチャー)之间的丝丝联系。促使人类终止彼此间的战争，一方面面对强大的异星人势力 Zentraedi(ゼントラーディ)和Proto Deviln(プロトデビルン)，用“文化的力量”寻找生存之道，一方面向着银河系进行移民而寻求新天地。最初的Macross，被看作改变了地球宇宙历史的“命运之船”！BigWest(ビックウエスト)制作，Studio Nue(スタジオぬえ)原作之Anime。1982年初代“超时空要塞Macross”(...
GA 艺术科美术设计班,12,0,9.5,1,https://www.bilibili.com/bangumi/play/ss1153,80615,79133,602,1223,1508,167029,1153,1153,"['萌系', '搞笑', '日常', '社团']",220.0,2009/7/6,故事中以彩井高中美术班“GA”一年级学生当中充满个性的五个女学生为中心，描写她们点缀着各种美术知识的上课情况以及围绕着她们展开的欢闹学园生活。其作者是参与过GBA游戏“公主联盟”人物设计的きゆづきさとこ，画风多以萌元素为主，虽然剧情平淡但却不显平庸，反而充满了温馨，搞笑与些许感动。
豹头王传说,26,0,9.5,1,https://www.bilibili.com/bangumi/play/ss1131,29484,29484,292,1198,2158,110114,1131,1131,"['奇幻', '热血']",161.0,2009/4/5,历史悠久的古老王国帕罗受到了边境的军事强国蒙古的奇袭，帕罗的国王和王后被杀害，首都克里斯塔尔陷落。公主琳达和他的双生弟弟雷姆斯利用藏匿在皇宫中的古代器械拼命逃离蒙军的追捕，两人误入一片神秘森林。危机之时，长着豹子头的超战士突然出现，从蒙军手中救出了姐弟俩人……
秀逗魔导士 第三季,26,0,9.5,1,https://www.bilibili.com/bangumi/play/ss1114,111800,15613,601,185,24727,556564,1114,1114,"['时泪', '奇幻', '热血', '魔法']",167.0,1997/4/4,第三部(TRY)里讲述了人类，魔族与神族之间的恩怨!这一部可说是三部中魔法场面最为华丽的一部。而故事的内容也真正的进入了主题!神族的巫女菲莉雅在收到火龙王的神谕后，找到了莉娜他们，希望他们能够拯救这个世界，而莉娜却完全没有要拯救世界的意思，但是在菲莉雅将一封莉娜的姐姐露娜的信交给莉娜看后，莉娜马上答应了菲莉雅的请求，从此开始了这场拯救世界的战斗旅程!为了菲莉亚说的神谕而旅行的主角们，在外界遇到了久违的兽神官杰洛士，还有把莉娜当成魔龙王的敌人大面积追杀过来的瓦尔加布。神秘的强敌终于出现了，而且主角们的魔法对他...
海月姬,11,1,9.5,1,https://www.bilibili.com/bangumi/play/ss995,85590,85590,826,5099,2265,193092,995,995,"['搞笑', '日常', '治愈']",713.0,2010/10/14,主角仓下月海是一名梦想成为插画家、并且非常喜欢水母的家里蹲。她为了梦想而来到东京，后入住了女生公寓“天水馆”。这里的住客大多是宅/腐女兼尼特族，对她们来讲拥有时尚感的现充全是敌人。一天，为了救水母，月海遇到了一名超美的伪娘。发生在尼特族、伪娘之间的个性故事就此展开！
刀语,12,0,9.5,1,https://www.bilibili.com/bangumi/play/ss983,257373,257373,7520,2414,77915,2607343,983,983,"['历史', '奇幻', '战斗', '催泪']",1936.0,2010/1/25,数月前日本轻小说家西尾维新的《化物语》宣布由shaft改编成TV动画，而现在，他的另一部小说《刀语》也宣布了动画化计划。两部作品同时被改编成动画，作者的实力也可见一斑。动画版由WHITE FOX工作室制作。 《刀语》于2007年1月开始连载，由西尾维新担任原作，竹担任作画，这是西尾的首部时代小说，小说一共有12话，于当年12月连载完毕。作品的舞台是被称为“尾张时代”的中世纪日本，是战国时代和将军家实现天下统一之间的故事。虽是虚构的时代，但历史和文化和实在的江户时代相似。这个时代有种不用刀的剑术——虚刀流，其第七代当主鑢（lǜ）...
真的有呀！灵媒先生,22,0,9.5,1,https://www.bilibili.com/bangumi/play/ss938,32489,32489,493,113,4554,423624,938,938,"['奇幻', '搞笑']",125.0,2011/4/12,「真的有呀!灵媒先生」是松本老师自08年开始在「月刊少年Rival」的四格漫画，至今已推出了6卷漫画单行本了，故事是以木林呪理先生为中心，一位兴趣是和死灵说话，而且拥有驱魔的天份。作为一个对驱魔有天份的人，她对彼方的世界非常熟悉，但作为一位老师，她却对现世却甚无知。当然，若在你的学校中出现了一位这么有趣的老师，不是闹出很多笑话便是很多灵异的恐怖事件，期待这位灵媒先生会为大家带来新的惊喜吧。
玛莉亚?狂热 第二季,12,0,9.5,1,https://www.bilibili.com/bangumi/play/ss921,176075,59911,3518,953,77436,1893343,921,921,"['搞笑', '日常']",594.0,2011/4/8,《玛利亚狂热》（まりあ?ほりっく）是远藤海成从2006年8月开始于月刊comic alive创刊号开始连载的漫画作品，通称まりほり（狂热玛利）。 本作是一部以女校为舞台、讲述了围绕著百合趣味的少女与伪娘少年之间的爱情喜剧。于2007年12月28日发售广播剧CD。由此改编的电视动画于2009年1月开始播放。第二季将于2011年4月播放，名为《玛利亚狂热 ALIVE》。
玛莉亚?狂热,12,0,9.5,1,https://www.bilibili.com/bangumi/play/ss920,176075,163603,4227,1448,55751,2040213,920,920,"['搞笑', '日常']",906.0,2009/1/4,宫前佳奈子为了找寻“命运之恋”转入了私立天妃女子学院，极度讨厌男人的她对满是美女的天妃感到兴奋不已。意外结识了学院校花祇堂鞠也之后，却没想到“她”竟是个男儿身！？佳奈子的恶梦就此展开……
无口的森田小姐,13,0,9.5,1,https://www.bilibili.com/bangumi/play/ss887,75003,65539,1273,921,6082,713147,887,887,"['日常', '泡面']",287.0,2011/7/5, 《无口的森田小姐（森田さんは无口）》是由日本漫画家佐野妙作画的四格漫画。 故事讲述主角女高中生森田真由，这位总是沉默寡言的无口少女的校园及日常生活。森田之所以总是不说话，并不是因为她讨厌说话或真的没话可说，而是因为常常在说话前会思考大量的事情，所以总是弄得错过了和别人一起交谈的时机。也因为这种错过，所以经常弄出笑话来。
UN-GO episode: 0 因果论,1,0,9.5,1,https://www.bilibili.com/bangumi/play/ss871?theme=movie,244561,40502,1106,569,7665,333813,871,871,"['奇幻', '智斗']",233.0,2011/11/19,故事讲述了被人称为最后的名侦探结城新十郎，与他的拍档因果，组成了要解明这世上之谜及真实的侦探二人组合。在面对常理不能解释的谜题或案件时，凭着新十郎的推理及因果的协力，这些难题往往也会迎刃而解。但是，当新十郎对案件越发思考之时，他便发现某些地方的不对劲，并随着他的深入了解，他和因果更渐渐与某件大事件扯上关系。
UN-GO  因果论 ,11,0,9.5,1,https://www.bilibili.com/bangumi/play/ss869,244561,230137,5497,1980,47911,2383742,869,869,"['奇幻', '智斗', '推理']",949.0,2011/10/13,故事讲述了被人称为最后的名侦探结城新十郎，与他的拍档因果，组成了要解明这世上之谜及真实的侦探二人组合。在面对常理不能解释的谜题或案件时，凭着新十郎的推理及因果的协力，这些难题往往也会迎刃而解。但是，当新十郎对案件越发思考之时，他便发现某些地方的不对劲，并随着他的深入了解，他和因果更渐渐与某件大事件扯上关系。
迷糊餐厅 WORKING!!,13,1,9.5,1,https://www.bilibili.com/bangumi/play/ss866,774378,625513,13757,5819,83508,4707185,866,866,"['搞笑', '日常', '声控', '美食']",2902.0,2010/4/4,《迷糊餐厅》（WORKING!!）是高津カリノ在漫画杂志《YOUNG GANGAN》2005年1号开始连载的四格漫画作品，之后改编成电视动画。原本是作者在自己的网站上不定期连载的网络四格漫画，后将加入新的舞台设定与登场人物而成为本作。舞台是在和网络漫画不同的餐厅“瓦古娜利亚”，但具有共通的世界观，以及店长的旧识与佐藤的乐团伙伴等相关联的角色。网络连载的部分被称为猫组，杂志连载称为犬组。但因为版权的关系，猫组的人物并未在犬组登场。2006年6月30日开始有手机发送的番外篇。2007年1月25日发售广播剧CD，2010年4月开始播放TV版动画。2011年4月...
南家三姐妹 欢迎回来,13,0,9.5,1,https://www.bilibili.com/bangumi/play/ss622,629668,132099,8838,1898,94559,3090367,622,622,"['萌系', '搞笑', '日常']",1282.0,2009/1/4,故事是围绕着南家的春香、夏奈和千秋三姐妹之间，以及周边人们的搞笑温情日常生活展开。本片的最大的看点就是，一家三个性格各异的妹子在家里和学校里的各种展开，有校园恋爱的误解、伪娘的奇怪产生、两姐妹的各种争斗等等日常搞笑内容。《南家三姐妹》是日本漫画家樱场小春所创作的漫画。原作其后改编为动画，前两季于2007年10月7日至2008年1月6日连续播放，第三季则于2009年1月4日播放，第四季则于2013年1月5日开始播放。此外，相关的OAD于2009年6月和2012年10月随漫画第六卷和第十卷的限定版同捆推出。
新蔷薇少女,13,0,9.5,1,https://www.bilibili.com/bangumi/play/ss525,588831,223741,5004,5240,30969,1759407,525,525,"['萌系', '奇幻']",1339.0,2013/7/4,提示：新作动画的内容与前两部旧动画无关，为漫画原作剧情。樱田纯，一名不愿上学而长期不出家门的中学生，热衷于上网购物，喜欢在购买物品后的退货限期内退回物品。有一天收到一封来信，上面只有一个「上发条还是不上发条」的选项，纯在好奇心驱使下选择了「上发条」，之后房间就出现了一个没有署名的神秘皮箱，里面装着一个非常美丽而且质感近似真人的少女人偶（ドール），使用木箱内的发条转动背部的开关后，人偶像有生命般的活动起来，向纯说：「我是真红，蔷薇少女第五人偶。」突然小丑布偶（漫画中则为小熊布偶，水银灯派出的）来袭，纯...
现视研 二代目,13,0,9.5,1,https://www.bilibili.com/bangumi/play/ss519,156121,78361,1673,1804,89409,990853,519,519,"['日常', '少女']",480.0,2013/7/6,《现视研》是木尾士目在《月刊午安》上连载中的漫画作品，单行本一共9本，台湾中文版由东立出版社发行。是部描写御宅族大学生日常生活的作品。 “现代视觉文化研究会”，简称“现视研”，是一个以研究动漫等综合性现代视觉文化为成立宗旨，但行吃喝玩乐之实的社团。主角笹原完士在成为大学新鲜人后，跟同为一年级新生的重度御宅族高坂真琴一起加入了现视研。但在都是“御宅族”的社团活动中，高坂的青梅竹马春日部咲对其展开攻势；即使与其交往之后发现了高坂的“御宅族”真面目，仍不放弃将他拉回正道，因而成为社团的常客。漫画《现视研》，...
玉响～more aggressive～,12,0,9.5,1,https://www.bilibili.com/bangumi/play/ss515,152383,38765,2624,430,23974,517947,515,515,"['日常', '治愈', '社团']",311.0,2013/7/3,这是一个描写喜欢摄影的高中一年级生泽渡枫和她周围的人的日常琐事的梦物语。泽渡枫是一个喜欢摄影的高中一年级生。这年春天，她搬到了濑户内海一个被青山和大海所包围的宁静小镇——广岛县竹原市。这是她去世的父亲童年生活的地方。这里有陈旧的街道，美丽的海景和善良的居民，当然，还有泽渡枫交到的新朋友们。在枫所拍摄的她所钟爱的这座城市的照片里，偶尔会看到玉响的存在。玉响是枫在拍摄时感受到幸福时候的光芒。幸福好像在一瞬间变成了具体的形状……而且这些照片总是能给大家带来幸福的感受。
夜樱四重奏 花之歌,13,0,9.5,1,https://www.bilibili.com/bangumi/play/ss473,164150,71335,3051,306,60604,1965383,473,473,['奇幻'],412.0,2013/10/6,"那是一个发生在彩之町、樱新町的幻樱奇谭 。樱新町连续在夜晚发生奇怪事件。 在这个樱花林立的地方, 因为得到非人类力量者的数量增加, 令混沌程度越来越严重, 挺身面对他们的是“比泉生活协商事务所”所有成员，新感觉的感人动作故事，就此展开…… 《夜樱四重奏》为作者ヤスダスズヒト在《月刊少年天狼星》的2006年3月号起开始连载的漫画作品。2008年10月起，改编的动画开始在TBS系电视台放映。2013年4月3日深夜的NICONICO生放送中宣布《夜樱四重奏》再次TV动画化的消息。"
头文字D Third Stage,1,0,9.5,1,https://www.bilibili.com/bangumi/play/ss209,571975,73614,4375,2278,87236,2598959,209,209,['运动'],592.0,2001/1/13,这部主要讲述梦想和前途。同场飙技的伙伴们在高中毕业后各自工作，有的去东京打工，有的在加油站工作。故事的主人公拓海最后选择了边工作边飞车，正职是运输公司的司机，同时加入了赤诚Red Sun车队，并为“改写各地的记录，留下传说”而奋斗。
迷你偶像,64,0,9.5,1,https://www.bilibili.com/bangumi/play/ss106,35045,29242,1858,391,15694,3553144,106,106,"['萌系', '日常', '泡面', '治愈']",220.0,2013/1/1,"《ぷちます!-PETIT IDOLM@STER-》是以《偶像大师》中登场的人物们以及与少女们存在着几分相似点的迷之生物""ぷちどる""们的闲散日常为背景描写的治愈系4格漫画。由明音绘制的四格漫画「变小!-小小的偶像大师-」，作为知名游戏「偶像大师」的派生作品，故事描写了765经纪公司的少女偶像们与不可思议的生物""迷你偶像""们的日常点滴。动画《迷你偶像（ぷちます！－PETIT IDOLM@STER－）》（又译《小小偶像大师》）是根据日本漫画家明音在《电击魔王》上连载的同名四格漫画改变的动画作品。在2012年9月23日的“东京电玩展2012”中宣布该作将动画化，同..."
