title,episodes,mark,score,is_finish,link,series_follow,follows,coins,likes,danmus,views,season_id,media_id,tags,comments,pub_date,intro
黄金拼图,12,1,9.7,1,https://www.bilibili.com/bangumi/play/ss443,388629,341167,9430,4782,70290,1733648,443,443,"['萌系', '日常', '治愈']",2500.0,2013/7/6,大宫忍是个15岁的女孩，黑色的双瞳、白皙的肌肤配上乌羽色的秀发，外表看上去纯和风的她其实曾经是英国寄宿家庭中的一份子。回国之后依旧对国外朝思暮想的她，有一天收到了一封航空信。寄件人居然是房东家的女儿爱丽丝。“小忍，这次轮到我去日本住了！”席卷爱丽丝与小忍一行人的日英美少女东西合并喜剧、即将开始！！《黄金拼图》是由日本漫画家原悠衣自2010年开始连载于《漫画时光KIRARA MAX》的四格漫画作品。故事主要围绕从英国回到日本的交换生少女大宫忍，追随大宫忍来到日本的英国少女爱丽丝，以及大宫忍的日本同学们的校园生活展开。
头文字D Final Stage,4,0,9.7,1,https://www.bilibili.com/bangumi/play/ss212,571974,72912,6274,2144,52614,4124195,212,212,"['时泪', '运动', '热血']",793.0,2014/5/16,头文字d第六部（头文字D Final Stage）是头文字d系列动画第六部作品。头文字d第六部也是系列动画的最终章。系列动画头文字d讲述的是男主角藤原拓海是一个刚考上驾照的18岁高中生，平日的他在加油站打工，对于汽车一点概念也无因此常被身边爱车族的友人取笑。但是私底下，拓海打从13岁时起，就被父亲藤原文太要求帮忙每天凌晨时开着车到山顶上的温泉饭店送豆腐，因此拥有非常丰富的驾驶经验。身为昔日山路赛车手的文太，刻意利用送豆腐作为理由训练儿子成为一名赛车手，他在车上的置杯架中放了一杯清水，要求拓海在不让杯中清水溢出的前提下，安...
宝石宠物 Tinkle☆,52,0,9.7,1,https://www.bilibili.com/bangumi/play/ss123,107862,93411,2781,1871,46551,2196378,123,123,"['萌系', '治愈', '魔法']",547.0,2010/4/3,魔法国度的“宝石乐园”中，有一种将宝石放在身体里的生物——“宝石宠物”，宠物们日夜不停学习魔法。直到某一天，因宝石乐园的大扫除日子已到，为避免麻烦，宝石宠物皆被乐魔女变成“宝石护符”，并放置在沉睡森林中。而宝石宠物之中，最调皮捣乱的露比，因为讨厌藏在森林中，便悄悄地跑到海边去玩。后来在送往沉睡森林的路途中，却因为一道不知名的强风将宝石护符吹落并以流星的形式落往“人间界”。从海边回来的露比，感受到宝石乐园产生异变而前往皇宫，乐魔女等人为了找回这些宝石宠物，便让露比前往人间加以寻找，以作为她偷跑出去的惩...
犬神同学和猫山同学,13,0,9.7,1,https://www.bilibili.com/bangumi/play/ss110,222211,222211,11666,3052,33930,4778429,110,110,"['日常', '泡面', '治愈']",2049.0,2014/4/10,故事围绕着高中一年级生犬神八千代，与同为女生的猫山铃之间的百合关系而展开。姓作犬神的八千代，实则是个萌猫咪的人；而性格更接近猫的猫山同学，则是萌狗的存在。某日，两人在命运的安排下邂逅并相知。之后每日你侬我侬，当初竖着毛抵触犬神的猫山同学变得愈加乖巧，而将她们两人凑合到一起的始作俑者柊木秋只剩下了吐槽的份。
机器人笔记,22,1,9.6,1,https://www.bilibili.com/bangumi/play/ss38137,10952,10952,644,5187,605,66676,38137,28233818,"['热血', '校园', '科幻']",151.0,2012/10/11,时代背景设定在世界变动率为“1.048596%”的2019年。在这样一个机器人已经普遍实用化的未来，种子岛中央高校的“机器人研究部”正面临废部危机，而仅有的两名部员之一的八汐海翔就算面临着如此情况，仍旧对“机器人研究部”兴趣盎然，并且依旧热衷于机器人格斗游戏。而另一位一根筋的废材部长濑乃宫秋穗为了避免被废部，正在以“完成巨型机器人”为目标奋斗着。然而某天，海翔发现了一份名为“君岛报告”的A.R.笔记。在这份笔记里面，记录着名为君岛安科的人将会把整个世界都卷进来的大阴谋……
城市猎人91 ,13,0,9.6,1,https://www.bilibili.com/bangumi/play/ss33168,176793,31556,1000,4760,3818,405055,33168,28228558,"['漫画改', '战斗']",274.0,1991/4/28,由北条司原作漫画《城市猎人》改编的动画
辣妹與恐龍（僅限台灣地區）,12,0,9.6,1,https://www.bilibili.com/bangumi/play/ss33115,10668,10668,762,3023,1499,67068,33115,28228505,['漫画改'],323.0,2020/4/5,辣妹與恐龍跨越了時代合租了一個房間。雖然恐龍什麼的不是那麼了解，但總會有辦法的對吧。總而言之姑且先「讓氣氛高漲」吧——～～！
輝夜姬想讓人告白？~天才們的戀愛頭腦戰~（僅限台灣地區）,12,0,9.6,1,https://www.bilibili.com/bangumi/play/ss33088,22238,22238,2353,4109,5728,287314,33088,28228478,"['漫画改', '搞笑', '校园', '恋爱']",915.0,2020/4/12,秀才們所聚集的菁英學校?秀知院學園在學生會相遇的副會長?四宮輝夜以及學生會生?白銀御行不管是誰都認為非常相配的這2位天才，還以為會馬上結合在一起，卻因為過高的自尊在干擾，導致連告白都不成!!“如何讓對方先告白”在這戀愛頭腦戰施展智慧與謀略的2人…稀世罕見的智能過熱爆走!!已經要無法控制了!!戀愛會讓天才變成呆子!!新感覺”頭腦戰”?戀愛物語再臨!!
宝可梦 就决定是你了！,1,1,9.6,1,https://www.bilibili.com/bangumi/play/ss32934,308021,40564,2546,6707,13477,511190,32934,28228297,"['游戏改', '奇幻', '冒险']",536.0,2017/7/15,住在真新镇的少年小智，迎来了能获得宝可梦训练家资格的10岁生日早晨。对从未见过的宝可梦，与从未见过的世界感到憧憬的他，应该到大木研究所领取要成为自己伙伴的宝可梦，可是小智睡过了头，等他抵达时只剩一只不喜欢人类的皮卡丘。“你是不是很讨厌我？可是，我很喜欢你哦！”尽管两人有过冲突，却也慢慢建立起友谊。外出旅行的那天，他们看见传说的宝可梦——凤王在天际翱翔。小智与皮卡丘拿着虹色之羽立下誓言——“总有一天，我们会一起去见它！”
Q版！黑色四叶草,8,1,9.6,1,https://www.bilibili.com/bangumi/play/ss31854,2105302,1098410,4259,3322,2828,1404956,31854,28226981,"['搞笑', '萌系', '战斗', '架空']",1063.0,2020/1/1,短篇动画《Q版！黑色四叶草》，主人公亚斯塔与他的竞争对手尤诺，为了成为魔法帝而不断积累实绩。这场把暴牛的同伴也卷入其中的激烈战斗即将开始！
ID:INVADED（僅限港澳台地區）,13,1,9.6,1,https://www.bilibili.com/bangumi/play/ss31818,17074,17074,1708,2682,3301,207328,31818,28226764,"['原创', '科幻', '推理']",2182.0,2020/1/6,本片講述利用能檢測出人們殺意的裝置以及利用思想粒子做出的“井”，來探知事件真相的科幻故事。
科學超電磁砲T（僅限港澳台地區）,25,1,9.6,1,https://www.bilibili.com/bangumi/play/ss31817,42203,42203,4778,8330,7035,618856,31817,28226758,"['漫画改', '战斗', '科幻', '校园']",945.0,2020/1/11,有 230 萬人口，其中八成人口為學生的「學園都市」，是比其他地區科技更為先進，並從事「超能力開發」的特殊地區。而整座學園都市中僅有七人的等級 5 超能力者之一御坂美琴，由於她的能力與個性使然，因而被捲入了學園都市中所發生的種種事件……
哆啦A梦：大雄的月球探险记,1,1,9.6,1,https://www.bilibili.com/bangumi/play/ss28772?theme=movie,1338448,844726,22449,22845,90298,4725280,28772,28223068,"['剧情', '动画']",3462.0,2019/6/1,月球探测器在月亮上捕捉到了白影，大雄认为这道白影是月亮上的兔子，惹来了大家的耻笑，于是哆啦A 梦为了帮助大雄，利用道具“异说俱乐部徽章”，在月球背面制造了一个兔子王国。一天，神秘少年露卡转学而来，与大雄和伙伴们一同前往月亮上的月兔王国展开了一场别开生面的浪漫想象力之旅。
香蕉喵 不可思议的伙伴们,13,1,9.6,1,https://www.bilibili.com/bangumi/play/ss28589,130520,74880,3594,17318,2636,947489,28589,28222687,"['原创', '少儿', '治愈', '萌系']",606.0,2019/10/1,这个世界里还有许多我们不了解的神奇生物。在某座星球上，诞生了一只不可思议的生物。它的名字叫「香蕉喵」。它们会在怎样的星球上诞生，过上怎样的生活呢？而且，如果它们也梦想来到地球的话…
東京暗鴉（僅限港澳台地區）,24,0,9.6,1,https://www.bilibili.com/bangumi/play/ss28076,102647,102647,1541,1171,6928,236464,28076,28221536,"['小说改', '战斗', '校园', '冒险']",941.0,2013/10/8,《東京暗鴉》講述的是壹個和陰陽師有關的故事。故事的主角土禦門春虎出身自陰陽道的名門——土禦門分家，然而他壹點“見鬼”的靈氣都沒有遺傳到，而且他也沒有成為陰陽師的願望，是個生活在鄉下的平凡普通的高中生。但是這壹切在他和土禦門下屆當家土禦門夏目再次相遇之後都改變了，因為偶然的事件，土禦門春虎進入了培養陰陽師成才的學院——陰陽塾，奇妙的故事從這裏開始了。
女高中生的虛度日常（僅限台灣地區）,12,0,9.6,1,https://www.bilibili.com/bangumi/play/ss28068,20026,20026,1906,4443,5425,257686,28068,28221525,"['漫画改', '日常', '校园', '搞笑']",406.0,2019/7/5,被浪費的青春——偏差值差不多的田中（通稱“笨蛋”）、沈迷於BL的菊池（通稱：“禦宅”）、面無表情的才女?鷺宮（通稱“機”）。個性十足的女高中生們無所事事的日常校園生活——
流汗吧！健身少女（僅限港澳台地區）,12,0,9.6,1,https://www.bilibili.com/bangumi/play/ss28063,21411,21411,2232,3520,5793,396174,28063,28221517,"['漫画改', '日常', '运动']",314.0,2019/7/3,「響……你是不是又胖了？」最喜歡吃吃喝喝的女高中生·紗倉響，因朋友毫不留情的一句話而受傷不已。決定在暑假之前瘦下來的響，卻因一人無法堅持鍛煉，陷入倦怠循環。於是響下定決心，開始走向了健身房！在響加入的健身房中，與同年級的精英美少女學生會長·奏流院朱美相遇，一腳踏入了深奧又快樂的，肌肉鍛煉的世界……。
FLIP FLAPPERS（僅限港澳台地區）,13,0,9.6,1,https://www.bilibili.com/bangumi/play/ss28055,38203,38203,516,773,2113,49021,28055,28221492,"['奇幻', '原创']",327.0,2016/10/6,對你而言，世界是怎樣的呢——。獲得了打開大門的鑰匙的兩位女主人公，帕皮卡和可可娜。少女與少女相遇，開始了在不同的時間、相異的空間“Pure Illusion”的冒險。在尋找著據說能實現願望的神秘結晶體“耳之碎片”而遊曆Pure Illusion的兩人面前，出現了各種各樣的困難。當兩人陷入危機之時，“耳之碎片”發出光芒，而她們也因此變身了。
机动战士高达 THE ORIGIN III：破晓起义,1,0,9.6,1,https://www.bilibili.com/bangumi/play/ss27808,166664,67618,2124,2242,7928,561887,27808,28221037,"['机战', '科幻', '漫画改']",563.0,2016/6/10,"宇宙世纪0074年。离开了德克萨斯殖民卫星的爱德华?玛斯，伪装自己的身分，以夏亚?阿兹那布尔之名，进入吉翁共和国国防军官学校就读。而与同届的扎比家少爷、卡尔马交情交深的夏亚，两人逐渐两人逐渐受到学生们的推崇。宇宙世纪0077年。终于，学生们以独立为号召，对地球联邦军治安部队展开武装起义。但那也正是揭开夏亚誓言复仇的华丽剧本序幕……。——现在，历史的齿轮即将转动！ """
小马宝莉  第五季 (中配）,26,0,9.6,1,https://www.bilibili.com/bangumi/play/ss27733,481465,47096,4766,7651,34124,5557448,27733,28220851,"['少儿', '魔法', '少女']",473.0,2015/4/4,小马宝莉（My Little Pony） 由美国玩具商孩之宝于2010年10月10日在美国The Hub电视频道开始播出的卡通影集。故事叙述了小马暮光闪闪为了执行导师宇宙公主给她的任务，与助手斯派克一起来到小马镇学习有关友谊魔法的知识，在学习和生活的过程中她结识了五位好朋友，并获得了真正的友谊。她们在谐律精华中，各代表一个关键元素。
梅露可物语 : 无精打采的少年与瓶中少女,12,1,9.6,1,https://www.bilibili.com/bangumi/play/ss25699,320714,320714,21693,23273,27219,2826130,25699,139452,"['萌系', '游戏改', '架空', '冒险']",2140.0,2018/10/11,本片改编自乐元素发行的手机游戏《梅露可物语 - 愈术士与铃之旋律 -》。
探险活宝 第六季（中配）,42,0,9.6,1,https://www.bilibili.com/bangumi/play/ss25503,41945,32482,1875,2453,7884,1020855,25503,130212,['搞笑'],212.0,2014/4/21,主人公是一个带着无可救药的傻气，充满天真浪漫的热情的人类小男孩阿宝，他最喜欢的事情就是冒险，梦想是成为伟大的英雄。作为阿宝的兄弟和最好的朋友，老皮是动画的另一个主人公，他是一只魔法狗，拥有神奇的变形伸缩能力，性格虽然玩世不恭，做事却成熟老成。在哇塞大陆他们一起打怪冒险，一起生活一起成长。
高达创战者 ?GM的逆袭,1,1,9.6,1,https://www.bilibili.com/bangumi/play/ss25345,216201,53099,1897,2448,7881,1127110,25345,125312,"['热血', '机战']",439.0,2017/8/25,矢岛竞技场的竣工仪式将在明天举行。尼尔斯．尼尔森设计了最新的大型对战系统，并邀请伊织诚和川口名人等人参与展览赛。伊织诚和众人久别重逢，打算展示为展览赛改装的宇宙型创制突击高达，却发现它不翼而飞…这个时候，竞技场的系统被人控制，伊织诚一行人被锁在里面。神秘集团出现在他们面前，向他们提出进行高达模型对战的挑战。
魔卡少女樱 Clear Card篇 序幕 小樱与两人的小熊,1,0,9.6,1,https://www.bilibili.com/bangumi/play/ss23910,3651873,106484,6441,4065,28196,2264109,23910,80072,"['魔法', '漫画改']",1382.0,2017/9/13,单行本第3卷同捆。
忍者少女千鸟～姐川·石山篇～,26,1,9.6,1,https://www.bilibili.com/bangumi/play/ss23857,250934,64771,5390,9441,4113,1586517,23857,78532,['漫画改'],627.0,2018/4/7,1555年，时为战国时代。有位青年怀抱着远大的梦想，被人称作大傻瓜的他正是后来的织田信长。有一位仰慕着青年的少女，被信长的梦想所吸引的她笑着说道“我要成为信长大人的忍者！”目标只有一个，那就是天下布武！
棒球大联盟 2,25,0,9.6,1,https://www.bilibili.com/bangumi/play/ss23821,65943,52155,6181,16912,27531,2847418,23821,77612,"['运动', '漫画改']",668.0,2018/4/7,本作讲述了前作主人公茂野吾郎的儿子茂野大吾作为星二代在棒球道路上的烦恼和成长——
續 刀劍亂舞 -花丸-（僅限港澳台地區）,12,0,9.6,1,https://www.bilibili.com/bangumi/play/ss21754,217157,217157,2496,9157,26043,747820,21754,12572,"['日常', '游戏改']",1037.0,2018/1/8,時為公元2205年。是以改變歷史為目的的“歷史修正主義者”開始對過去實施攻擊的時代。被賦予了守護歷史這壹使命的“審神者”，由他們所喚起的最強付喪神“刀劍男士”。這是，他們以“某個本丸”為舞臺，壹心壹意、開朗明快地生活的“花丸”日常物語——
中二病也要谈恋爱！Lite,1,0,9.6,1,https://www.bilibili.com/bangumi/play/ss21683,4306917,249088,18169,7275,70478,4167852,21683,10192,"['小说改', '恋爱', '校园']",1802.0,2012/9/27,第一季的WEB动画
剧场版 笑傲昙天(外传) 「前篇」,1,1,9.6,1,https://www.bilibili.com/bangumi/play/ss21326?theme=movie,254574,66840,1913,671,5426,687637,21326,8712,['奇幻'],417.0,2017/12/2,明治时期，围绕着日本最大的湖泊·琵琶湖畔的监狱所展开的冒险剧作。被大蛇玩弄于鼓掌之中的—阴家、豺、风魔— 故事中描写了他们的过去以及未来。
游戏王剧场版 光之金字塔,1,0,9.6,1,https://www.bilibili.com/bangumi/play/ss21109?theme=movie,674428,41122,1021,168,18084,1542969,21109,8592,"['智斗', '战斗', '漫画改']",639.0,2004/8/13,一直想要打败游戏重新夺回三张神之卡的海马濑人，为了找到能打败游戏的卡而去找贝卡斯，并且从贝卡斯那里了解到贝卡斯他确实有那样的卡片。于是海马用三张青眼白龙做赌注向贝卡斯挑战赌牌决斗并战胜了他，按照贝卡斯的预想，海马应该只从贝卡斯给他提供的牌组里拿走青眼光龙一张卡，但海马却拿走了两张卡，按照海马的作风，他是不会对贝卡斯牌组里的其他卡片感兴趣的，于是贝卡斯立刻就感到事情不妙，并想阻止海马，却无济于事。另一方面，游戏在博物馆参观一批刚从埃及运回来的文物时，发现了一个与自己的千年积木相似的水晶做的金字塔，据说...
火球 幽默之章,3,0,9.6,0,https://www.bilibili.com/bangumi/play/ss20603,26845,9222,552,526,401,151415,20603,8332,"['科幻', '泡面']",185.0,2017/10/6,Fireball Humorous动画全集又名火球第三季，是一部全3DCG动画，背景设在未来遥远的星球，故事主要讲述机器人大小姐，杂用机器人，宠物机器猴子以及隐形的机器女仆们在一间豪宅里的生活琐事。
结城友奈是勇者 鹫尾须美之章&勇者之章,12,1,9.6,1,https://www.bilibili.com/bangumi/play/ss6448,522064,300472,23258,7873,82045,4443668,6448,6448,"['少女', '魔法', '原创', '冒险']",4652.0,2017/10/7,故事发生在神世纪300年，主要讲述结城友奈是初中2年级学生，她天天在学校里过着与很多朋友一同听课、进行社团活动、玩耍的平稳生活。不管怎么看这都是非常普通的女孩的生活日程，但是只有一点与其他孩子决定性不同的地方，那就是她所属的名为“勇者部”的社团活动。以部长犬吠埼风为中心的该社团的活动内容与被谜团包围的叫做Vertex的不可思议的存在有关系，本作正是以描写友奈等人的“勇者部”的活动为主。
魔女的考验【日语】,51,0,9.6,1,https://www.bilibili.com/bangumi/play/ss6375,82294,44133,1755,1452,31740,1337062,6375,6375,"['魔法', '少儿']",327.0,2005/7/2,"《魔女的考验》(シュガシュガルーン) 又名《魔界女王候补生》可爱的魔女香草缪和巧克莉媚尔为了要争取魔界女王的宝座而来到人界接受考验！她们需要通过比赛看谁收集到比较多的心,这些心是使用魔法将人类的情感结晶化而成的。鲜红色的心是热情的爱,粉红色的心是甜美的恋爱悸动……下个目标将是你的心唷～"
咕噜咕噜魔法阵 新系列,24,1,9.6,1,https://www.bilibili.com/bangumi/play/ss6332,98255,82552,10991,1474,41493,2162549,6332,6332,"['搞笑', '科幻', '魔法', '漫画改']",957.0,2017/7/12,作品的舞台被称为“咕噜咕噜”的世界，正如上所说的，是一个中世纪如在欧洲等系列勇者斗恶龙的世界，典型的幻想RPG拥有着魔法和妖精与怪物的存在（RPG游戏的精细的设置也被遵循了）。这个世界是由五片大陆所组成的。每一个魔神管理着一个大陆，主要的舞台的人间世界有着怪物和妖精居住着。神和天使等住在天界等的异次元地区也存在着。
黄金拼图 Pretty Days,1,0,9.6,1,https://www.bilibili.com/bangumi/play/ss6205?theme=movie,388629,46876,4700,1217,5591,326601,6205,8692,"['萌系', '日常', '治愈']",853.0,2016/11/12,来自英国的转学生，爱丽丝·卡塔雷特！现在正在好朋友大宫忍的家中寄宿。爱丽丝与忍、凸凹组合小路绫与猪熊阳子、追着爱丽丝过来的另一位英国留学生九条可怜，亲密五人组迎来了高中二年级的秋天！爱丽丝与忍，两人一起穿过玄关，走上阳光照耀的闪闪发亮的上学路。在已经习惯的道路上一路小跑，在一如往常的车站前，与一如往常的成员们会合。绫与阳子，以及可怜的笑容正在迎接爱丽丝她们。似乎随处可见，却又是世间绝无仅有的只属于她们的珍贵日常——Pretty*Days！在第二次的学园祭临近的这个时刻，忍的样子显得有些奇怪！？“这种时期，早上总...
Dimension W~维度战记~ OVA,1,0,9.6,1,https://www.bilibili.com/bangumi/play/ss6183,119607,119607,668,31,1050,641756,6183,6183,"['科幻', '战斗']",491.0,2017/5/19,21世纪最大的发现与发明——次元间电磁诱导装置，通称[线圈]。通过线圈，人类获得了无穷无尽的能量。通过不断朝小型进化的线圈自由地获得电力已经成为可能，这个发明正推动着整个世界，开启了崭新的时代。描绘出科学与人类应该前往的未来“progressivesF”始动！有利必有弊，犯罪者们获得能量武器也更加容易，因此产生了处理此类问题的回收者。这是一个回收者的故事。
结城友奈是勇者 -鹫尾须美之章-,3,0,9.6,1,https://www.bilibili.com/bangumi/play/ss6075?theme=movie,522064,108185,5486,988,15060,1093931,6075,6075,"['少女', '魔法']",1076.0,2017/3/18,《结城友奈是勇者》的前传剧场版《结城友奈是勇者：鹫尾须美之章》将于2017年3月开始上映，本作一共分为三章，后两部将会在4月、7月上映。现在官方公开了本作剧场版的CM，其中鹫尾须美、乃木园子和三之轮银三个可爱的妹子都以战斗形态登场了，战斗场景也是相当不错的。
田中君总是如此慵懒 特典,7,0,9.6,1,https://www.bilibili.com/bangumi/play/ss6036,595591,351864,7083,7487,17337,4946359,6036,6036,"['搞笑', '治愈']",886.0,2016/6/24,田中君总是如此慵懒 动画特典
机动战士高达 雷霆宙域战线 第一季,4,0,9.6,1,https://www.bilibili.com/bangumi/play/ss6006,266120,173955,4884,3993,28366,3785462,6006,6006,['机战'],1159.0,2015/12/25,宇宙世纪 0079 年，SIDE 3「吉翁公国」正式对地球联邦政府宣战后将近一年时，在原本太空殖民卫星 SIDE 4「姆亚」的遗址「雷霆宙域」，一心想要夺回故土联邦军「姆亚同胞团」的「伊欧.弗莱明」少尉，与由战中失去肢体的吉翁军人所组成的实验狙击手部队「活死人师」的「戴瑞.罗伦兹」上士，各自怀着不同的目的与想法，爆发了激烈的攻防战……。
不要输！！恶之军团！,12,1,9.6,1,https://www.bilibili.com/bangumi/play/ss5956,27883,27883,2516,150,6985,522433,5956,5956,"['搞笑', '泡面']",287.0,2017/4/5,《不要输！恶之军团！》将于今年4月正式开播。而从近期公布的主创成员名单来看，这个阵容更加具有亮点。其中负责本作监督的是曾制作过《Love Live！》、《GATE奇幻自卫队》等作品的京极尚彦，音乐监督则为业界著名人士长崎行男。
龙的牙医,2,1,9.6,1,https://www.bilibili.com/bangumi/play/ss5933,382194,382194,19897,11485,52723,3224146,5933,5933,"['奇幻', '战斗', '原创', '架空']",2876.0,2017/2/18,一个架空世界，在龙之国传说中龙与人类签订了契约互帮互助。野野子是专门帮国家守护神龙清理蛀牙菌的新人牙医，龙之国目前正在处于和敌国的战争中，而且战争日趋激烈，某天野野子在龙的巨大牙齿上发现了晕倒的敌国少年兵，少年的名字叫贝尔，而野野子将这名少年捡了回来……
剧场版 银河机攻队Majestic Prince 觉醒的基因,1,0,9.6,1,https://www.bilibili.com/bangumi/play/ss5924?theme=movie,58405,21033,588,246,2956,386108,5924,5924,['机战'],125.0,2016/11/4,实现了踏足宇宙的人类们，将许多资源小行星纳入了手中，并认为那未来与繁荣也会来临身边。但是，自称泛银河统一帝国的谜之势力“乌尔伽尔”对人类发起了攻击，地球陷入了生死存亡之危机。通过了基因调整、为了战斗而出生的少年少女5人：「Team Rabbits」的出(Izuru)、浅木(Asagi)、惠(Kei)、环(Tamaki)、骏河(Suruga)，驾驶最新锐战斗装置「AHSMB」进行了战斗，并在最终决战使得乌尔伽尔的部队退了兵。但在那战斗之中，出……。在这样的Team Rabbits面前，新的外敌、新的战斗在等待着他们——。
幼女战记 短篇,12,0,9.6,1,https://www.bilibili.com/bangumi/play/ss5914,211017,211017,7941,7370,10068,6620143,5914,5914,"['泡面', '架空']",1083.0,2017/1/6,幼女战记短篇版动画片全集是改编自日本小说家KARURO·ZEN著作，由NUT制作的短篇版、Q版动画。统一历1923年6月。金发碧眼的幼女，谭雅·提古雷查夫，正作为部队勤务的一环而在北方军管区诺登战区第三巡逻线进行帝国军士官学校最终课程的研修。作为航空魔导师向着光辉履历踏出第一步的研修，平安无事地结束——本该如此。但事态却向着超出预料的方向转变。以协约联合的越境侵犯为契机，帝国与协约联合进入战争状态。随着转移至战时体制，谭雅被交付了观测任务，但协约联合军发动奇袭，谭雅陷入不得不与敌军魔导师中队单独交战的事态。敌众我寡，就...
