title,episodes,mark,score,is_finish,link,series_follow,follows,coins,likes,danmus,views,season_id,media_id,tags,comments,pub_date,intro
青山刚昌短篇集,2,1,9.8,1,https://www.bilibili.com/bangumi/play/ss36724,42054,42054,3699,14313,4359,554725,36724,28232389,"['漫画改', '恋爱']",354.0,1999/3/17,《青山刚昌短篇集》特辑。在包含了《名侦探柯南》作者青山刚昌的出道作的短篇集中，青山亲自选出3部作品作成了动画。虽然是《名侦探柯南》发表前的作品，但是OVA已经和播放中的《名侦探柯南》同期制作，且工作人员和声优均为原班人马。《青山刚昌短篇集1》 3部作品的阵容是《要等我哦》、《彷徨的红蝴蝶》、《夏天的圣诞老人》。每部都以“时间”、“空间”和“相遇”为主题。《要等我哦》和《夏天的圣诞老人》都是在科幻色彩的世界观中，高中生纯洁的恋爱模样的写照，时而诙谐幽默，时而又紧张严肃，是一部回味无穷的佳作。另一部《彷徨的红蝴...
斩服少女 OAD,1,0,9.8,1,https://www.bilibili.com/bangumi/play/ss34241,1329569,32219,24186,6789,42722,1831576,34241,28229688,"['原创', '热血', '奇幻']",808.0,2014/9/3,『斩服少女』BD/DVD第9卷收录的一集未放送的特别篇
怪盗基德,12,0,9.8,1,https://www.bilibili.com/bangumi/play/ss33383,648310,439718,29411,33390,107632,7358307,33383,28228780,"['漫画改', '智斗']",3783.0,2010/4/17,拥有“平成鲁邦”之称的怪盗基德，无论防备多么严密的钻石珠宝对他来说都易如反掌。他一直是中森银三等警官的梦魇，而关于他的身份却始终是个谜。某高中二年级学生黑羽快斗，是一个出身于魔术世家的俊朗男孩，他与青梅竹马的女孩中森青子终日打情骂俏，乐在其中，也由此惹出了诸多的麻烦。偶然机会，他在父亲黑羽盗一的画像后面发现一间密室，在这里不仅发现了各种精密的设备，也发现8年前因事故去世的父亲竟和基德有着千丝万缕的关系。数日后，消失多年的怪盗基德发出预告，将要盗取东京市美术馆的宝石月之瞳。警察与盗贼新的战争就此展开……
奇诺之旅,13,0,9.8,1,https://www.bilibili.com/bangumi/play/ss33327,574715,101403,10643,6649,65613,3517891,33327,28228718,"['小说改', '奇幻', '冒险']",1382.0,2003/4/8,奇诺离开了自己居住的国家，与师傅和艾尔梅斯一起在森林中的小屋里住了下来。除了一边帮助师傅做杂活外，还会接受枪械和驾车训练。就这样每天驾着艾尔梅斯练习。某天，奇诺去河边打水，遇上了一位旅行者，他与曾经为了救奇诺而牺牲自己的青年有着同样的打扮，这勾起了奇诺的回忆并使自己与其交谈起来。自此之后，奇诺下定了决心，要开始她自己的旅程。
BanG Dream! 梦想协奏曲 电影演唱会,1,1,9.8,1,https://www.bilibili.com/bangumi/play/ss31861,646174,460507,13587,10091,23523,856280,31861,28227003,"['音乐', '社团', '少女', '声控']",3905.0,2020/1/6,花咲川女子学园结成的少女乐团「Poppin’Party」、从小玩在一起的 5 人所交织而成的王道少女摇滚乐团「Afterglow」、事务所的牵线而诞生出的偶像乐团「Pastel＊Palettes」、以厚重的世界观为魅力的本格派乐团「Roselia」、为了让世界充满欢笑并传递很多旋律的「Hello、HappyWorld！」，五个乐团所迈向的下一个舞台是……！「BanG Dream!」首次的电影演唱会动画「BanG Dream! FILM LIVE」即将举行！
机动战士高达 THE ORIGIN VI：红色彗星的诞生,1,0,9.8,1,https://www.bilibili.com/bangumi/play/ss29051,166661,47758,3105,4100,15374,971871,29051,28223747,"['机战', '科幻', '漫画改']",1031.0,2018/7/13,过去篇共6话，终于迎来了完结——。故事发生在宇宙世纪 0079 年 1 月 23 日，吉翁与地球联邦间一决雌雄的战争，终于在 SIDE 5 鲁姆爆发。在战争中被逼入绝境的吉翁，手中握有秘密武器。就是用人型兵器「MS」所组成的特别突击大队，让战况一举逆转并大获全胜。当中，隶属吉翁军的夏亚?阿兹那布尔，驾驶着「萨克Ⅱ」立下战积并因此晋升为少校，更获得「红色彗星」的别名。而在鲁姆会战后，地球联邦军策画了对抗吉翁军的＂V 作战＂。远在 SIDE 7 的少年阿姆罗?雷，自行动身去找寻新兵器「钢弹」的秘密。另一方面，在地球的南极大陆，吉翁及地球...
剧场版 阿松,1,1,9.8,1,https://www.bilibili.com/bangumi/play/ss28960?theme=movie,711147,467807,9463,10507,27540,949767,28960,28223473,"['日常', '漫画改', '搞笑']",3282.0,2019/11/9,某天，六胞胎参加了高中同窗会。与成长为成熟大人、在社会上活跃的同学们重逢。对比之下发现自己完全不成器，他们因此大受打击，喝完闷酒之后睡着了。第二天早晨，清醒的小松等人注意到房间中的异变，来到街上。印入眼中的是与平日里不同却又有些熟悉的景色。众人正要怀疑这里是不是「过去世界」时，大裤衩告知他们「6人中的某人，在这个时代留下了巨大的遗憾」。为确认真相，他们要去见的人，是18岁时的自己…
吹响吧！上低音号～想要传达的旋律～,1,1,9.8,1,https://www.bilibili.com/bangumi/play/ss28950?theme=movie,1421693,655735,10766,7208,14304,1033273,28950,28223447,"['小说改', '日常', '校园', '萌系']",3565.0,2017/9/30,重制于电视动画《吹响吧！上低音号》第二季的总集篇剧场版，加入了部分原来TV没有的新画面。
吹响吧！上低音号～欢迎来到北宇治高中吹奏乐部～,1,1,9.8,1,https://www.bilibili.com/bangumi/play/ss28938?theme=movie,1421693,651529,10266,7723,14879,999668,28938,28223435,"['小说改', '日常', '萌系', '校园']",3128.0,2016/4/23,重制于电视动画《吹响吧！上低音号》的总集篇剧场版，加入了部分原来TV没有的新画面。
排球少年！！第二季（僅限港澳台地區）,25,0,9.8,1,https://www.bilibili.com/bangumi/play/ss28737,56227,31423,1201,916,12364,460935,28737,28223025,"['漫画改', '热血', '校园', '运动']",764.0,2015/10/3,在宮城縣預選賽敗于青葉城西後，烏野高中排球部為了春季高中排球賽而努力，為了磨練實力，他們參加了由枭谷學園組織，包括音駒高中在內的數所關東高校組成的練習賽團體。通過這次合宿，烏野高中排球部的所有人都得已“進化”，于春季高中排球賽上大放異彩。
排球少年 烏野高校 VS 白鳥澤學園高校（僅限港澳台地區）  ,10,0,9.8,1,https://www.bilibili.com/bangumi/play/ss28115,56227,42357,1139,730,6811,249305,28115,28221589,"['漫画改', '热血', '运动', '社团']",893.0,2016/10/7,“沒落的強豪，無法飛翔的烏鴉”——。曾經被如此稱呼的烏野高中，終於抵達的“頂”之舞臺。春季高中排球宮城縣代表決定戰，優勝。在高中聯賽預選準決勝中惜敗於青葉城西高中，朝著春高預選再次啟程的烏野，為追求更高等級而挑戰的是與關東強豪隊伍進行的聯合合宿。痛感到與並列於梟谷、生川、森然、音駒的全國級別隊伍之間的力量差，烏野高中追求著隊伍的“進化”，壹心持續著挑戰。終於到來的春高預選。壹度封印起來的日向與影山的“怪人速攻”展現出更進壹步的進化，每個齒輪相互咬合，驅動著隊伍全體，烏野將並列的強豪們擊破。之後，在宮...
彼方的阿斯特拉（僅限港澳台地區）,12,0,9.8,1,https://www.bilibili.com/bangumi/play/ss28017,92702,92702,5597,5269,16089,479027,28017,28221416,"['漫画改', '科幻', '冒险']",3127.0,2019/7/3,在宇宙的彼方存活下去吧。時值太空旅行已司空見慣的時代。凱亞德高中的學生阿莉艾斯·斯普林，因為即將啟程參加第一次行星露營而激動不已。和她同屬一個小組的是，包括在太空港有過一面之緣的卡納特·霍西吉曼在內的9名成員。一行人順利抵達了行星馬庫珀……但是很快就發生了出人意料的事態。
机动战士高达 THE ORIGIN I：苍瞳的卡斯巴尔,1,0,9.8,1,https://www.bilibili.com/bangumi/play/ss27064,166661,101992,4034,3597,6679,900278,27064,28220112,"['机战', '科幻', '漫画改']",1039.0,2015/4/24,宇宙世纪0068年，SIDE 3，慕佐自治共和国。准备发表从地球联邦政府完全独立宣言的吉翁．兹姆．戴肯，突然在演说中倒下并离开人世。戴肯的两位遗孤卡斯巴尔与阿尔黛西亚，其命运有如接下来激烈动荡的时代般，正等着他们…
MIX,24,1,9.8,1,https://www.bilibili.com/bangumi/play/ss26770,190527,190527,30476,32641,42131,6287594,26770,21989385,"['漫画改', '运动', '社团', '恋爱']",4461.0,2019/4/6,由于父母的再婚，虽然无血缘关系的但出生年日相同的双胞胎（？）兄弟——立花投马与立花走一郎是明青学园初中部·棒球社的初中二年级生。作为捕手和击球手的走一郎非常的活跃。而投马由于某些原因而担任三垒手，却拥有着作为投手的才能。走一郎的亲妹妹同时也是投马无血缘关系的义妹·立花音美也进入了初中，三人之间的氛围也发生了一些变化。升上高中的投马与走一郎，到底能否站在甲子园的土地之上——
ENDRO~!,12,1,9.8,1,https://www.bilibili.com/bangumi/play/ss26275,299669,299669,13025,14258,47466,2184377,26275,28227618,"['原创', '奇幻', '萌系', '搞笑']",4605.0,2019/1/13,人们与怪物共存的剑与魔法的大陆“纳拉尔岛”。那里曾经存在恐怖的“魔王”。很久很久以前，初代勇者打倒了出现在纳拉尔岛的魔王——从那以后，魔王在各种时代不断地复活，同时与之对抗的勇者也再度出现……少女们为了打倒不知何时出现的魔王，而在冒险者学校就读。稍微有些脱线却具备勇者体质的尤夏。因为过于认真而一直很辛苦的精灵圣者塞拉。喜欢吃东西的开朗战士法伊。安静的狂热魔法使梅。以成立勇者小队为目标的4人，无论过了多久都没有一点要打倒魔王样子的悠闲奇幻生活开始了。
灰与幻想的格林姆迦尔 OVA,1,0,9.8,1,https://www.bilibili.com/bangumi/play/ss24745,1234458,95965,16040,5817,12221,1752112,24745,106612,"['奇幻', '战斗', '架空', '穿越']",3304.0,2016/3/16,TV未播放的2.5话。我们为什么要这么做……？哈尔希洛回过神来，才发现自己身处在黑暗当中，他完全不知道自己人在何处，也不明白这个地方是哪里。他的身边有一群和他一样失去记忆，只记得自己名字的男女；而离开了地底后，等待着众人的是一个「宛如游戏」的世界。为求生存，哈尔希洛与自己有着相同境遇的伙伴们组成队伍、学习技能，以义勇兵见习者的身份踏入了这个世界--「格林姆迦尔」。没有人知道未来会遇见什么……这一切，就是从灰烬之中所诞生的冒险谭。
BanG Dream! 少女乐团派对☆PICO,26,1,9.8,1,https://www.bilibili.com/bangumi/play/ss24569,195961,135204,21254,25365,21141,8600994,24569,135252,"['萌系', '音乐', '少女', '游戏改']",3187.0,2018/7/5,"Girls Band的秘密圣地、Live House「CIRCLE」，迷你偶像少女们将大显身手，带来有笑有泪还暖心(?)的少女偶像乐团喜剧！期待的超新星「Poppin'Party」、于顶点孤高绽放的苍蓝蔷薇「Roselia」、青梅竹马共组的王道女子摇滚「Afterglow」、华丽缤纷却又轻松随兴的偶像乐团 「Pastel＊Palettes」、让全世界充满笑容的「Hello,HappyWorld！」，众成员将为了炒热现场气氛东奔西走！"
鲁邦三世 PART5,24,1,9.8,1,https://www.bilibili.com/bangumi/play/ss23854,421085,231976,4918,15505,12248,1520010,23854,78472,"['搞笑', '时泪', '漫画改']",2746.0,2018/4/3,在现代的数字社会，使用瓦尔特P-38手枪开着老爷车的鲁邦三世使用互联网与众多数字移动终端来面对敌人。神出鬼没、异想天开、大胆妄为的大大盗鲁邦三世在新时代的法兰西的前所未闻无法预测的故事再次拉开帷幕！鲁邦三世和次元大介在法国。故事从法国乡下阿帕特曼的一间房间里开始。这是一个什么都能买到毒品、枪支等违法的东西的黑暗网站，“马尔科普”。为了盗取数字虚拟货币，鲁邦一伙儿侵入了网站经过重重戒备的巨大服务器。在那里遇到的是神秘的天才黑客少女，埃米。鲁邦和埃米一起，去了马可波罗的陷阱。根据敌人所进行的“鲁邦游戏”，被...
变形金刚：领袖之证 中文第三季,16,0,9.8,1,https://www.bilibili.com/bangumi/play/ss6181,121114,32670,3411,3535,47025,2229803,6181,6181,"['热血', '科幻']",514.0,2013/3/22,"“Roll out with Optimus Prime, Bumblebee, Arcee, Ratchet, Bulkhead, and the rest of the heroic Autobots as they battle the evil Decepticons. Now that big bad Megatron has returned with a mysterious and dangerous element, Team Prime must prepare for an epic battle. But that's not so easy when they have to guard over Jack, Miko, and Raf -- three normal kids who?ve accidentally discovered the Autobots. As Team Prime works to defend Earth from destruction, the drama gets just as intense as the heav.."
元气少女缘结神 新婚篇,1,0,9.8,1,https://www.bilibili.com/bangumi/play/ss5882,2605229,611463,71003,13838,134239,8625568,5882,5882,"['恋爱', '奇幻']",2831.0,2016/12/20,描写了高中毕业和御影神社毕业临近，向着各自道路前进的奈奈生，巴卫，瑞稀、鞍马的最后时光
名侦探柯南 瞳孔中的暗杀者,1,1,9.8,1,https://www.bilibili.com/bangumi/play/ss5365?theme=movie,3497438,118177,13194,11570,88345,3035318,5365,28228944,"['漫画改', '推理', '智斗']",3212.0,2000/4/22,专针对警察的连续杀人案件发生了，警察内部引起巨大的回响。对于想得到案件情报的小五郎，目暮警部却意外地守口如瓶。看到如此情况的柯南，联想到事情可能和警察部有莫大的关系。然后，下一个被枪击的目标居然是佐藤刑警!刚巧在案发现埸出现的小兰受到案件的刺激而被弄至失忆!犯人为了杀人灭口，于是企图把唯一的目击证人杀害!深知情况严重的柯南，为了保护小兰，不惜孤身犯险去把犯人找出来!
吸血鬼猎人D,4,0,9.8,1,https://www.bilibili.com/bangumi/play/ss5351?theme=movie,279948,279948,12554,6895,32428,2802831,5351,5351,['奇幻'],2747.0,2000/8/25,根据小说版第三作《D-妖杀行》改编。2000年8月25日以《Vampire Hunter D: Bloodlust》片名在美国上映。与前作OVA版相较，本片则受到原作者菊地秀行的高度评价。日本在2001年4月21日，先以英语配音版配日文字幕方式于院线上映，之后在发行英语版DVD一段期间后，比英语版先行制作的日语配音版本才另行推出DVD上市。台湾由普威尔发行的授权DVD，则为英日双语同时收录。
名侦探柯南 通往天国的倒计时,1,1,9.8,1,https://www.bilibili.com/bangumi/play/ss5316?theme=movie,3497438,116709,11208,11140,87235,3116735,5316,28228945,"['漫画改', '推理', '智斗']",2562.0,2001/4/21,柯南和少年侦探团在参观一座西多摩新建的双子摩天大楼时，意外的发现了黑暗组织成员琴酒(Gin)。随后又发生了杀人事件。杀人事件还在继续，共同点是每名死者身边都会留下一个小的酒杯。就在柯南和少年侦探团寻找凶手的时候，琴酒也得知他正在寻找的叛徒雪莉将在不久之后参加西多摩双子大楼的落成典礼，并准备在典礼上将她刺杀。在典礼会场上，短暂的黑暗之后又有一人被害。现场也留下了小酒杯，显示凶手和之前的为同一人。就在警方和毛利小五郎调查案件的时候，琴酒引爆了藏在大楼内的炸药，销毁了黑暗组织和常磐财团的交易证据，同时将楼顶的柯...
名侦探柯南 迷宫的十字路口,1,1,9.8,1,https://www.bilibili.com/bangumi/play/ss5156?theme=movie,3497438,128568,12671,12866,85667,3394094,5156,28228948,"['漫画改', '推理', '智斗']",2839.0,2003/4/19,小五郎应京都寺院的邀请，前往京都调查寺内八年前佛像盗窃事件。寺院早前得到佛像下落的线索，是一件有不同图案的图画，提供给小五郎，以便尽快寻回佛像。同时间，东京、大阪和京都发生杀人事件，三个城市的警方调查后，发现事件中的死者都是盗贼团“源氏萤”的成员，毎人都有一个代名，以《义经》内的传统人物命名。服部亦因此事，前往京都调查杀人事件的真相。期间遇上柯南，两人一起调查两宗事件，发现两宗事件都有共同点，有助解开八年前佛像盗窃事件。在调查期间亦发生杀人案，服部因此而受袭，和叶亦因查找施袭者线索而被人挟持。
星之梦～星之人～,1,1,9.8,1,https://www.bilibili.com/bangumi/play/ss5051?theme=movie,1125516,195497,28982,5549,70458,1563176,5051,5051,['催泪'],3998.0,2016/9/3,剧场版动画《星之梦～星之人～》是由david production根据Key社游戏《星之梦》改编。2016年4月15日公布详情。2016年9月3日在日本上映。
地狱少女 二笼,26,1,9.8,1,https://www.bilibili.com/bangumi/play/ss4880,2035146,317628,15296,7429,194643,4790656,4880,28220983,['原创'],2981.0,2006/10/7,在都市的小孩子中，有着这样一个传言： 只要在深夜0点的时候与“地狱通信”取得联系，将无法发泄的怨恨写下来，地狱少女就会出现，她将为你把怨恨的人打入地狱。 然而让人意想不到的是，这个传言竟然是真实的。 写给地狱通信的信件都会传达给一名叫做阎魔爱的少女，当她与信件中的怨恨感情产生共鸣的时候，她就会变身成为地狱少女。 但是，若要实现愿望就要与她缔结契约的事，却没有在传说中提及到。 “人的诅咒会打开两个通道。一个是把对手送往地狱的，而你的灵魂在死后也会往地狱同行。即使这样也无所谓吗？”
最终幻想VII：降临之子,1,0,9.8,1,https://www.bilibili.com/bangumi/play/ss4720,233086,227564,16975,6492,38187,2070374,4720,4720,"['科幻', '战斗', '架空']",3641.0,2005/9/14,故事从97年《最终幻想VII》结局两年之后开始，当人们以为世界已经和平之时，所谓的“星痕症候群”的病却开始四处蔓延，世界再度面临危机。同时曾经为拯救世界而战的英雄克劳德却与世隔绝孤独的生活着…… 剧情叙述主角们打倒赛菲罗斯（Sephiroth），拯救星球免于巨大陨石的侵袭后两年，神秘的怪病「星痕症候群」在各地陆续传出病例。而主角克劳德（Cloud）在与爱莉斯（Aerith）死别后，便郁郁寡欢。某日突然出现了与赛菲罗斯有未知关联的神秘3人组，除了直接对克劳德造成威胁之外，还进行着一连串秘密的计划，将已回归各自生活的主角群们，再次...
堀桑与宫村君,3,0,9.8,1,https://www.bilibili.com/bangumi/play/ss4333,279274,279274,13203,29609,16089,3228140,4333,4333,['恋爱'],2392.0,2012/10/5,在片桐高中上学的堀京子有着华丽的外表，同时成绩优秀、家务万能。某天，受伤的弟弟创太被陌生的“ピアス男”——同班的阴郁男生，宫村伊澄——送到家。惊讶于在学校与家中的不同，被看到在家中的另一面的京子动摇了。而以关怀害羞认生的创太为契机，宫村开始频繁的访问堀家。
魔法少女小圆 剧场版 [后篇] 永远的物语,1,1,9.8,1,https://www.bilibili.com/bangumi/play/ss4317?theme=movie,2155995,1002940,9261,10428,23692,1035760,4317,28220104,"['原创', '战斗', '奇幻', '魔法']",2818.0,2013/10/26,前两部《魔法少女小圆》之剧场作品为12集电视版本之总集篇，其中计划包括重新剪辑的电视版内容和配乐，并会追加全新作画。前篇命名为“开始的故事”（始まりの物語），于2012年10月6日上映；后篇命名为“永远的故事”（永遠の物語），于一周后的2012年10月13日上映。
魔法少女小圆 剧场版 [前篇] 起始的物语,1,1,9.8,1,https://www.bilibili.com/bangumi/play/ss4316?theme=movie,2155995,1068484,11302,11315,33347,1279155,4316,28220103,"['原创', '奇幻', '战斗', '魔法']",3037.0,2012/10/6,《魔法少女小圆剧场版 [前篇] 起始的物语》是日本2011年的原创动画《魔法少女小圆》剧场版动画系列的第一部作品。该剧场版和《魔法少女小圆剧场版 [后篇] 永远的物语》共同作为电视版总集篇。
前进吧！登山少女  第二季,24,1,9.8,1,https://www.bilibili.com/bangumi/play/ss4115,350270,69856,6035,3823,30325,1042731,4115,102352,"['治愈', '萌系', '日常']",1451.0,2014/7/9,故事承接第一季剧情，葵在重遇喜欢户外活动的青梅竹马朋友日向后，再次进行登山活动，实现了再一次看到小时候看过的山顶日出这样想法，并且与枫和心夏成为了好朋友。而接下来，葵她们将不断的挑战着自己，决定登上富士山。
苍穹之法芙娜EXODUS,13,0,9.8,1,https://www.bilibili.com/bangumi/play/ss4108,143782,73704,2575,1796,13174,1030287,4108,4108,"['机战', '战斗']",1087.0,2015/1/8,【本片翻译由雪飘工作室提供】故事背景在剧场版《苍穹之法芙娜 HEAVEN AND EARTH》的2年后，由于与来主操的邂逅，龙宫岛获得了与Mir对话的手段，这也给岛带来了可能性。阿尔维斯的孩子们一边进行战斗的准备，一边摸索着理解敌人的方法。2年后的现在，龙宫岛获得了更进一步的进化，理解Festum语言的少女与被Festum所守护的少女，当两人相遇之时，新世界的门将打开……
蜡笔小新 呼风唤雨！夕阳下的春日部男孩,1,1,9.8,1,https://www.bilibili.com/bangumi/play/ss3885?theme=movie,1339266,67979,4168,3280,32009,1301638,3885,35572,"['萌系', '搞笑', '少儿']",779.0,2004/4/17,《夕阳下的春日部男孩》》（日语：クレヨンしんちゃん 岚を呼ぶ!夕阳のカスカベボーイズ）是《蜡笔小新》的第十二部剧场版，全称是《呼风唤雨！夕阳下的春日部男孩》（原名：クレヨンしんちゃん 岚を呼ぶ!夕阳のカスカベボーイズ）于2004年4月17日上映，也是第二副没有野原小白的剧场版海报。由日本漫画家臼井仪人创作的同名漫画改编的动画《蜡笔小新》的剧场版（电影版）系列。指东宝公司从1993开始每年发行一部电影版蜡笔小新故事。在原作者臼井仪人逝世后曾一度传言2009年为最后一部剧场版（后被澄清）按惯例每年4月份上映。
蜡笔小新 呼风唤雨！大人帝国的反击,1,1,9.8,1,https://www.bilibili.com/bangumi/play/ss3880?theme=movie,1339266,75515,7314,4315,40840,1485853,3880,11152,"['萌系', '少儿']",1465.0,2001/4/21,这天在小新居住的春日部附近，突然新开了一家叫“20世纪博”的游乐园。游乐园里到处播放着从前20世纪的旧的电视节目和电影，这里，一切都是从前时光的回放。每一个到了这里的大人，都沉浸在过去的旧时光里，而对小孩子来说，这些的东西一点意思都没有。令小新万万想不到的是，进入了游乐园的爸爸妈妈都不在理会其他事情，只是一直沉醉在以往的时光里。城里的大人们都进去了，只剩下了小孩子！这到底是谁的阴谋，小新他们能否粉碎这阴谋？
魔卡少女樱 被封印的卡片,1,1,9.8,1,https://www.bilibili.com/bangumi/play/ss3860?theme=movie,3651871,244159,4310,12150,6128,423720,3860,3860,['魔法'],2683.0,2000/7/15,封印的卡片是《魔卡少女樱》又名《百变小樱》或《库洛魔法使》《CardCaptor Sakura》的第2部剧场版，第1部没有名字，大家公认为《香港之旅》。《封印的卡片》紧接在TV版70集后，是整个故事的大结局（不过后面还有一部同时上映的剧场版3，但与整个故事无关）
高智能方程式：SIN,5,0,9.8,1,https://www.bilibili.com/bangumi/play/ss3811,133840,26805,1932,1016,20219,1484874,3811,3811,"['热血', '运动', '时泪']",564.0,1998/12/21,由于2020年名云京志郎事件，使得AOI车队被罚禁赛一年。在禁赛的期间里，加贺一直为了等待与风见隼人再度比赛而忍耐着。然而到了2022年参赛前，A98董事会却作出了取消参加高智能方程式赛事的提案，经过重回领队职位葵今日子的极力争取，才达成协议，如果AOI车队在2022年不能夺取世界冠军的话，那么AOI将永久退出高智能方程式比赛。然而，已经停止了一年的赛车开发工作，使得AOI车队的赛车“超级史巴利安Z/A-10”已经远远落后于其它车队的赛车，纵然加贺拼命比赛，但仍然被压倒性地击倒。正当加贺为此而深深苦恼的时候，名云京志郎像幽灵般出现在...
