title,episodes,mark,score,is_finish,link,series_follow,follows,coins,likes,danmus,views,season_id,media_id,tags,comments,pub_date,intro
仰望半月的夜空,6,0,9.3,1,https://www.bilibili.com/bangumi/play/ss1391,71898,71898,2122,785,8272,488979,1391,1391,"['奇幻', '治愈', '小说改', '催泪']",483.0,2006/1/12,高二那年的冬天，由于突发的肝炎入院的裕一。虽然病情很轻，但他常常在半夜跑出医院的行为却让让护士亚希子很生气。某天，裕一从亚希子那里听到了让他和刚转院的女生聊天的请求，她感觉那孩子似乎很棘手。忐忑不安地走进病房的裕一，看到了一位乌黑长发的美少女——里香。两人间一段短暂的故事就此开始……
幻影少年,24,0,9.3,1,https://www.bilibili.com/bangumi/play/ss1255,143788,143788,2100,3770,23844,1208421,1255,1255,['奇幻'],365.0,2008/4/7,主人公昶（chǎng）偷懒不想上学，在从学校踏上归途的途中，遇到一个穿着黑色大衣没有影子的可疑人物。这个对自己说是做“人型之影”的那个男人，叫做白银，他说“我一直在寻找你”。面对过分的白银觉得可疑，完全不打算相信他的昶，白银说“算了，现在不讲了，我们还会见面的，因为，我们的命运连接在了一起。”就这样，一对美丽帅哥担任主角的幻想传奇就此展开…… 不对，是从而开始了昶与黑暗世界搏斗的昏天暗地日子。而且，同班同学的风纪委员铃野绫，还有总是和昶一起行动的朋友浅村贤吾也一起加入了这场光和影的战斗……
西洋古董洋果子店,12,0,9.3,1,https://www.bilibili.com/bangumi/play/ss1232,55613,55613,478,44,14272,401553,1232,1232,"['日常', '治愈', '美食']",159.0,2008/7/3,《西洋古董果子店》讲述的是一个不擅长甜食的，名叫橘圭一郎的有钱人家的少爷开的一家西点店，在这家西点店里有超一流的西点师、橘的同级生、魔性同性恋的小野裕介，有超级喜欢甜食的原拳击手神田英司，以及超级笨手笨脚的，喜欢上了小野的小早川千影等人聚集在一起，描写人生经历的一个个故事。
图书馆战争,13,0,9.3,1,https://www.bilibili.com/bangumi/play/ss1196,124010,114914,1585,348,25723,875874,1196,1196,"['奇幻', '热血']",394.0,2008/4/11,为了公序良俗等理由，政府制定了侵犯人权的“媒体净化法”，并成立了“媒体净化委员会”与“净化特务机关”来进行净化工作。与这个强权机关对抗的唯一组织，即为“图书馆”。一群热爱图书馆自由的人们，武装自己与净化机关进行战争，守护图书馆的自由。笠原郁在高中的某一天看到了想买的书，却遇上了净化委员会的成员，这时却出现了一名男人，使对方离开。西元2019年（正化31年），笠原郁加入了战争
大正野球娘,12,0,9.3,1,https://www.bilibili.com/bangumi/play/ss1148,14075,14075,131,54,5720,62778,1148,1148,"['运动', '社团']",139.0,2009/7/2,故事发生的当时是大正时代（1912年7月30日至1926年12月24日）14年，在上女子学校的小梅正好14岁。是经营西餐店的父母的独生女。某天，小梅和大家通称“大小姐”的一位朋友进行了一番商量，希望组建一支女子棒球队，来和男子棒球队进行比赛……“我想请你和我一起打棒球”虽然个性倔强，但很少被称为任性的“大小姐”晶子，却突然说了这样突兀的话。其起因在某个宴会上碰上了一个令人厌恶的男人，而对方自豪的是棒球运动，这就成为了晶子想要用棒球打败对方的原因。理由就是么简单。在这个良家女子学校中，大家连棒球一无所知，也不知道会不会容...
NEEDLESS,24,0,9.3,1,https://www.bilibili.com/bangumi/play/ss1147,42153,42153,317,23,10636,462293,1147,1147,"['科幻', '热血']",268.0,2009/7/2,2130年，受第三次世界大战的影响，日本各地均出现了被称为“BS（Black Spot）”的巨大污染区域。“BS”被作为废墟用巨大墙壁隔离，然而不久，这荒芜的大地出现了居民。他们被住在“城市（City）”里的人称为“无用者（Needless）”，而当中也有特殊能力者存在。故事的开端是名为库鲁斯·西尔特的少年，他所属的反抗组织的目标是从西美翁的暴力统治中解放“BS”。在一次与亚当·阿库莱特的战斗中反抗组织被攻破，幸存者库鲁斯只身一人逃进地下水道。在被追兵追赶的时候，救助他的是和阿库莱特相貌相似的阿当·布雷特。库鲁斯和布雷特后来来到了教会...
青之花,11,0,9.3,1,https://www.bilibili.com/bangumi/play/ss1146,58961,58961,1029,530,2240,407363,1146,1146,"['日常', '少女', '治愈']",318.0,2009/7/1,万城目富美在入学典礼的那一天，与分别10年、就读于另一所女校的青梅竹马奥平明相遇了。活泼爽朗的明与打扮朴素的爱哭鬼富美，两名女生不久就回忆起儿时的 情谊。酷酷的篮球部部长、校内的大好人杉本恭己；明的同学、总给人一种成熟感的井汲京子。两所女校的四个女生，从此展开似恋非恋、复杂细腻的青春故事……。原作是志村贵子连载于太田出版社旗下的杂志「漫画Erotikusu 」的百合漫画「蓝花」，讲述了少女们徘徊于友情与爱情之间的青春故事，以优雅的画风、以及善于把握青春期纤细多变的心理和难以捉摸的感触著称。由知名制作会社J.C.STAFF改...
乃木坂春香的秘密,12,0,9.3,1,https://www.bilibili.com/bangumi/play/ss1062,241306,220958,3957,2309,22347,1022065,1062,1062,"['日常', '恋爱']",695.0,2008/7/10,"我的同学乃木坂春香，姿容娟秀，才艺出众，别名""白银的星屑"",粉丝俱乐部人数超过三位数，是一名名副其实的深闺千金型的校园偶像。相较之下，我是一个平凡的普通少年，在各方面都没有突出的表现。一直以来，我都觉得这位超级完美的校园偶像非常遥远，因此我与她没太多的接触，不过在某个偶然之下，我发现了他不为人知的秘密。从知道他秘密的那天起，我的平凡的学园生活即将宣告结束，我们之间微妙的关系也因此开始。春香隐瞒众人的秘密其实是…"
STAR DRIVER 闪亮的塔科特,25,0,9.3,1,https://www.bilibili.com/bangumi/play/ss994,100513,100513,789,57,35717,1181340,994,994,"['科幻', '机战', '搞笑', '热血']",860.0,2010/10/3,南十字岛是一座坐落于日本南方的丰饶小岛，某天夜晚，一位名叫津名志拓人的少年来到了这座岛上。这个独自从本土游来的少年，进入了岛上的南十字学园高中部学习，性格开朗向上的他遇到了扬卷和子、进藤须方等充满个性的学生，并与他们深入交流、结下了友谊。但是，这个南十字学园其实隐藏着巨大的秘密。沉睡於地下的巨像“Cybody”，自称“绮罗星十字团”的谜之秘密结社，巫女们的歌声，以及拓人自身抱有的秘密……以被蓝天大海包围的南国之岛为舞台，爱情、梦想、友情的青春之歌，现在开幕！
神的记事本,12,0,9.3,1,https://www.bilibili.com/bangumi/play/ss897,908565,908565,24243,8899,189873,7262393,897,897,"['日常', '小说改', '推理']",4026.0,2011/7/2,神様のメモ帐（神的记事本）是日本作家杉井光所做轻小说，并衍生成为漫画，动画及广播剧作品。该作故事讲述了“尼特侦探”爱丽丝和身为侦探助手的藤岛鸣海所编织的无奈奇怪但稍微会展现出一点勇气的故事。在闹区的巷道中，有著一间拉面店「ラーメンはなまる」（花丸拉面店），後门通往「NEET侦探事务所」。街上尼特族的统御者爱莉丝，以及平常不认真过日子的尼特族们，为了解决事件而奋斗……
在盛夏等待,12,0,9.3,1,https://www.bilibili.com/bangumi/play/ss814,476428,469081,10210,6218,51492,2078208,814,814,"['科幻', '催泪', '恋爱', '原创']",2150.0,2012/1/9,夏日的三个月中，热爱摄影、个头矮小的男孩雾岛海人和朋友们打算要拍一部电影，女主角就是神秘转学生三年级的学姊贵月一花，但海人和一花的相遇藏着另一个秘密……天空湛蓝，万里无云。积雨云翻涌，仿佛要将彼岸的山隐藏。这是我们小镇上常见的风景。但是，也是无可替代的“盛夏”。那个男孩有一个模糊的想法，“一无所有却想做点什么”。所以和同伴商量一起拍电影。就在那时，一个“特别”的女孩来到了这个小镇。然后将男孩的想法视为“特别”。男孩的名字是——雾岛海人。女孩的名字是——贵月一花。他们的盛夏开始了。我们在那个盛夏等待——
薄樱鬼 雪华录,6,0,9.3,1,https://www.bilibili.com/bangumi/play/ss764,415544,63711,910,428,22949,795123,764,764,"['历史', '声控', '乙女']",163.0,2011/8/5,薄樱鬼即指土方岁三。此名为游戏土方线结尾土方与风间决战前风间所起。薄樱意为如樱花般绚烂而又转瞬即逝；鬼则指土方身为人类，却始终坚持贯彻自身信念，高洁之心令人钦佩，拥有能与鬼族平起平坐的强大实力与内心（风间是鬼族，一直对自己的鬼族身份感到骄傲，视罗刹为不伦不类的“伪物”）。其实新选组众成员又有哪个不是如此呢？
薄樱鬼 碧血录,10,0,9.3,1,https://www.bilibili.com/bangumi/play/ss762,415544,103180,5275,2321,153574,3840055,762,762,"['历史', '声控', '乙女']",328.0,2010/10/2,薄樱鬼即指土方岁三。此名为游戏土方线结尾土方与风间决战前风间所起。薄樱意为如樱花般绚烂而又转瞬即逝；鬼则指土方身为人类，却始终坚持贯彻自身信念，高洁之心令人钦佩，拥有能与鬼族平起平坐的强大实力与内心（风间是鬼族，一直对自己的鬼族身份感到骄傲，视罗刹为不伦不类的“伪物”）。其实新选组众成员又有哪个不是如此呢？
闪电十一人 GO,47,0,9.3,1,https://www.bilibili.com/bangumi/play/ss612,48423,7353,559,1150,9206,474138,612,134852,"['热血', '奇幻', '运动', '少儿']",111.0,2011/5/5,雷门中学的足球部是一个仅有7名部员的弱小队伍，社团内聚集了一批拥有各自爱好，每天荒废度日的部员，在队长円堂守慢慢找寻包括豪炎寺修也的队员开始，雷门中学的足球力量开始壮大，故事由此展开...闪电十一人（日文：イナズマイレブン），是由游戏改编而成的动画，于2008年10月5日（星期日）上午9：00在日本东京TV下的6个电台进行首播。
限制级杀手,10,0,9.3,1,https://www.bilibili.com/bangumi/play/ss495,73518,73518,2205,302,25068,2650111,495,495,"['搞笑', '泡面']",315.0,2013/10/10,史上最帅气、同时也是最幽默的杀手登场了！杀人不眨眼的冷面杀手同时也是冷面笑将！且看这位坚守岗位的杀手大哥如何面对一心想复仇的竹箭美少女的追赶。充满时下最流行的爆点，令人捧腹的冷笑小剧场……《限制级杀手》（日语：杀し屋さん）是由TAMACHIKU（负责剧本的一条マサヒデ与担任作画的ちく的共同笔名）创作的四格漫画，连载于双叶社刊《漫画ACTION》上，已在09年连载完毕，单行本共发行了4卷。作品主要以日本第一的杀手先生为中心，描写了他与被他牵连的警官、被害者、警犬等角色所经历的各种令人捧腹大笑的故事。
武士弗拉明戈,22,0,9.3,1,https://www.bilibili.com/bangumi/play/ss476,129492,129492,1397,3181,13016,585532,476,476,"['搞笑', '科幻', '热血', '偶像']",869.0,2013/10/10,主人公是自称“武士·弗拉明戈”的青年，以及一位年轻警察。两名男子相识后活跃在为正义而战的战斗中。紧张而有漫画风格的情节即将展开，这是一场英雄的演出。
琴浦小姐,12,0,9.3,1,https://www.bilibili.com/bangumi/play/ss417,314233,314234,28742,22993,255484,6554373,417,417,"['日常', '催泪', '校园', '恋爱']",3735.0,2013/1/10,本作主要讲述了主人公——转校生琴浦春香乍一看是普通的女子高中生，实际上是拥有阅读人心的能力的人。正是因为这样，她与周围的一切都疏远了。不过这样的她在邂逅了本作的另一位主人公真锅义久后，渐渐被其所吸引。就这样这部学园幻想爱情喜剧正式拉开帷幕。
潜行吧！奈亚子 Remember My Love,12,0,9.3,1,https://www.bilibili.com/bangumi/play/ss408,801016,476340,6273,3329,12447,5789814,408,408,"['萌系', '奇幻']",450.0,2010/12/10, 某日夜里，高中生八坂真寻，行走在夜道上被怪物袭击，然后被谜之少女所救。那个少女自称是克苏鲁神话中登场的一个名为“Nyarlathotep”（日语为ニャルラトホテプ）的邪神，还是一名外星人，为派遣来保护真寻免于其他外星人袭击。两人之间的恐怖（？）、Love（craft）喜剧就这样拉开了序幕…… 《潜行吧！奈亚子》是由逢空万太创作的轻小说，自2009年4月开始连载。作品在GA文库刊行之后，获得了极大好评，曾荣获第1回GA文库大赏优秀奖。由XEBEC制作的动画版，与此前的FLASH动画不同，本作将回归主线。
机器人少女Z,9,0,9.3,1,https://www.bilibili.com/bangumi/play/ss218,34374,30378,557,407,4128,245380,218,218,['科幻'],166.0,2014/1/4,故事发生在未来，“Z组合”平时在东京练马区大泉学园光子力町进行新型能源“光子能源”的宣传活动，偶尔将前来搞破坏的地下帝国的尖兵（机械兽少女们）揍飞（顺便发泄压力）。是日常搞笑与暴力相结合的动画。东映公司将于2014年1月推出的新作动画「机器人少女Z」，本作被宣传为将“机器人动画金字塔顶端”的“魔神系列三部曲”变身为美少女，集结日常轻松卖萌和暴力战斗为一体的新作动画！
罗德岛战记-英雄骑士传-,27,0,9.3,1,https://www.bilibili.com/bangumi/play/ss163,120484,78898,1542,4123,5538,989362,163,163,"['时泪', '奇幻', '架空', '冒险']",246.0,1998/4/1, 撼动罗德斯岛全境的英雄战争已过了五年，马莫帝国的黑衣骑士亚修拉姆，造访位于罗德斯岛东北部的玛法大神殿。为了传说中拥有可控制罗德斯力量的“支配权杖(支配の王锡)”，帕恩与蒂德莉特、弗雷姆王卡修一行人，前往魔龙晨曦之星(流星)所栖息的火龙山，和亚修拉姆展开一场激战。（到第8集为止）十年后，憧憬帕恩的少年史帕克，已成长为弗雷姆的见习骑士。在偶然的场合下，撞见马莫帝国的黑暗妖精入侵王城的藏宝库却又无力阻止。为了取回被盗走的宝玉“魂之水晶球”，史帕克与同伴们踏上了追寻黑暗妖精的旅程。旅途中和被命运引导的少女妮丝相...
最终休止符～无止境的螺旋物语～,12,1,9.2,1,https://www.bilibili.com/bangumi/play/ss34088,49073,49073,1288,5437,3881,388194,34088,28229528,"['游戏改', '奇幻', '搞笑']",375.0,2018/4/11,“Period”，是将诞生自绝望的异形怪物“Spiral”打倒之人的名号。隶属于Arc End第8支部的见习Period·哈尔，也为了斩断绝望的轮回，而投身于无止境的战斗当中……。——然而！！！神秘的盗窃事件引发了财政破绽，因此被本部舍弃的第8支部所剩下的Period，竟然只剩哈尔等3人。他们为了重建支部，而投身于无止境的黑暗营业当中！
弩級戰隊H×EROS（僅限港澳台地區）,12,0,9.2,1,https://www.bilibili.com/bangumi/play/ss33868,72477,72477,2372,6240,15336,341842,33868,28229301,"['漫画改', '战斗', '架空']",791.0,2020/7/4,地球因迷之侵略者·外星人規制蟲而面臨巨大的危機。規制蟲通過吸取人們的H能源來奪走人類生存所需的能量。為了從規制蟲手中拯救地球，高中生炎城烈人加入守護地球的戰隊「HXEROS」來保衛地球擊退規制蟲——。
怪盗基德（中配）,12,0,9.2,1,https://www.bilibili.com/bangumi/play/ss33395,648323,36860,2804,6969,11417,1480220,33395,28228792,"['漫画改', '智斗']",280.0,2010/4/17,拥有“平成鲁邦”之称的怪盗基德，无论防备多么严密的钻石珠宝对他来说都易如反掌。他一直是中森银三等警官的梦魇，而关于他的身份却始终是个谜。某高中二年级学生黑羽快斗，是一个出身于魔术世家的俊朗男孩，他与青梅竹马的女孩中森青子终日打情骂俏，乐在其中，也由此惹出了诸多的麻烦。偶然机会，他在父亲黑羽盗一的画像后面发现一间密室，在这里不仅发现了各种精密的设备，也发现8年前因事故去世的父亲竟和基德有着千丝万缕的关系。数日后，消失多年的怪盗基德发出预告，将要盗取东京市美术馆的宝石月之瞳。警察与盗贼新的战争就此展开……
理科生墜入情網，故嘗試證明。（僅限港澳台地區）,12,1,9.2,1,https://www.bilibili.com/bangumi/play/ss31819,11994,11994,417,1022,1028,68855,31819,28226765,"['漫画改', '日常', '搞笑', '校园']",130.0,2020/1/10,故事敘述主角冰室和雪村是熱衷於研究的理科生，凡事講求證據、利基於理論，就連落入情網後也依舊保持理科生本性。為了證明出彼此「喜歡」的情感，用盡各種意想不到的方式結合理科與戀愛，試圖找出確切證明。實驗過程好笑又有趣，一改理科艱澀難懂的刻板印象。兩人的互動再加上研究室裡充滿特色的夥伴，是部搞笑又帶點知性的作品。
小書痴的下剋上:為了成為圖書管理員不擇手段!（僅限台灣地區）,14,0,9.2,1,https://www.bilibili.com/bangumi/play/ss28693,7160,5436,631,2234,1692,81835,28693,28222860,"['小说改', '穿越', '架空', '励志']",133.0,2019/10/3,從小就是個超級書痴的女大學生麗乃，愛書愛到希望在書堆裡死去。該說是「夢想成真」嗎？好不容易應徵上圖書館工作的她，卻在地震時被掉落的書給活埋……當她再度醒過來，發現自己竟然轉生到了陌生的異世界，變成名叫梅茵的五歲小女孩，不但生在貧窮的士兵家，而且還體弱多病，但最讓她難以接受的是，這個世界完全找不到任何書店或圖書館。就算想看書，也是一般平民根本買不起的天價！於是梅茵下定決心：「既然買不到書，那我就自己動手做！」憑藉著對書的滿腔熱情，目標是成為圖書管理員。為了在異世界也能過著被書環繞的美好生活，就從做書開始努力吧！
碧藍幻想 第二季（僅限港澳台地區）,14,0,9.2,1,https://www.bilibili.com/bangumi/play/ss28575,65498,34301,1017,3411,3939,176404,28575,28222669,"['游戏改', '战斗', '奇幻', '架空']",227.0,2019/10/5,嚮往著天空、目標星之島的少年，在遇見了有著藍髮的不可思議的少女後，命運和生命便繫在一起。開始朝天空旅行的少年與少女，遇見了值得信賴的同伴們，還有能橫渡天空的騎空艇。躲過了帝國的追擊、和星晶獸的邂逅，加深了兩人的羈絆並有所成長。但是，前往星之島的路程才到一半。少年與少女，將和同伴一起往下一個旅程邁進。
魔術學姐（僅限港澳台地區）,12,0,9.2,1,https://www.bilibili.com/bangumi/play/ss28019,123555,123555,4597,6669,5913,609567,28019,28221418,"['漫画改', '搞笑', '恋爱']",842.0,2019/7/2,「我遇到了…可愛卻有點奇怪的學姐！」雖然喜歡魔術，卻因迷糊導致失敗率高達100%！？雖然很可愛，卻有點廢柴！？被這樣的學姐強行拉進奇跡社，甚至被當做了「助手」……。將多才多藝的姐弟「小咲」和「小真」，還有化學社的「斑」也捲入，今天的學姐也活力十足，有些色色的，創造大失敗！讓人看不下去，卻又想繼續看的廢柴魔術搞笑動畫！！
古城荆棘王,1,0,9.2,1,https://www.bilibili.com/bangumi/play/ss27812,32247,32247,1119,2042,2230,135445,27812,28221041,['冒险'],330.0,2010/5/1,故事的舞台是离今稍微远点的未来。世界上正流行这一种感染后在60天之内就会石化，死亡率高达100%的奇病“美杜莎”。为了在未来寻求这种在全世界爆发的不治之症的治疗方法，于是决定将Cold sleep（冷冻睡眠，简称CS，是指将人体保存在低温状态让人保持沉睡的状态，防止人的身体随着时间老化的一种方法。多见于SF作品之中。）投入实用了。少女霞从众多的人中脱颖而出成为了世界上仅有的160个拥有CS资格的人。他们在苏格兰的古城中制造出来的Cold sleep capsule center（冷冻睡眠胶囊中心，简称CSCC，如字面上的意思进行冷冻睡眠的地方。）中进入...
香蕉怪大叔 呐呐~呐（第一季）,24,1,9.2,1,https://www.bilibili.com/bangumi/play/ss27048,42330,10235,478,330,1576,168260,27048,27601888,['原创'],248.0,2018/4/6,贫穷的电视台，随着唯一的高收视率节目结束，虽有着拍摄稀有动物KINA的计划，却在预算与人才全无的情况下，仅派了3名STAFF向丛林进发。
男子啦啦队！！,12,0,9.2,1,https://www.bilibili.com/bangumi/play/ss26688,28387,28387,833,1645,4979,263343,26688,18747402,"['运动', '小说改']",231.0,2016/7/5,有一项经由为人应援而成为主角，世界上唯一的运动——。在啦啦队上赌上青春，虽然特别却又可爱的男子大学生们的物语，那就是《男子啦啦队!!》。在柔道上遭遇挫折的坂东晴希，被幼时的好友桥本一马邀请，而组成了前所未闻的男子啦啦队“BREAKERS”。聚集在一起的有，好认死理的沟口、很能吃的阿顿、轻浮的关西人·弦和一郎、以及有过啦啦队经验的美青年·翔，这些独具个性的人们。有着“想要打破”的某些东西的男儿们，开始了新的挑战……！
剧场版「 - Alice in the Garden -」,1,1,9.2,1,https://www.bilibili.com/bangumi/play/ss25951,242131,45236,982,1518,2050,235351,25951,1340832,['奇幻'],212.0,2018/11/1,城田真昼是一个凡事都奉行简单的高中一年级男生。某天他在路上捡了一只黑猫回家，并将之取名为「小黑」。没想到那只猫其实是名为史利比亚修的吸血鬼仆人──SERVAMP，意外成为黑仔主人的真昼，随之被卷入了一场由名叫「椿」的真祖所引发的吸血鬼大战，究竟他能不能顺利地守护自己的朋友与家人，SERVAMP们的身上到底隐藏着什么样惊人的秘密？吸血鬼和主仆契约的战斗奇幻故事就此开始了。
能继续奔跑下去真是太好了。,4,1,9.2,1,https://www.bilibili.com/bangumi/play/ss25856,26445,26445,786,1386,1052,167937,25856,2435657,"['原创', '励志', '职场']",334.0,2018/10/8,和朋友一起参加动画活动朗读会的凑，被在那里见到的声优演技所吸引，进入水道桥动画学院，与千歌子相遇。千歌子是凑搬过来的房间的前任住户，也是在USB留下信息的本人。同样以声优为目标，却无法将灵魂注入角色而苦恼的凑，与因过去的心伤而胆怯的千歌子，两人在互相激励的同时，也在面对面注视着自己。前辈凌太和景等人，也在见证两人的成长。止步不前而烦恼着的两人，在前方所发现的事物是——。
火之丸相扑,24,0,9.2,1,https://www.bilibili.com/bangumi/play/ss25730,191325,191325,24921,23765,45368,7525246,25730,139672,"['热血', '漫画改', '运动']",2704.0,2018/10/5,斗志昂昂！怀揣梦想的大汉们开始了激烈的斗争——弱小的大太刀高中相扑部出现的新生、“体型小”的?少年潮火之丸！这个在“身高”“体重”上均不适合比赛的体格的新入部员，实际上有着可怕的过去！？火之丸和弱小相扑部达到顶峰的道路——―白热化的高中相扑，开幕！！
高达创战者 TRY 岛上热战,1,1,9.2,1,https://www.bilibili.com/bangumi/play/ss25451,216202,45963,1159,1949,9927,861274,25451,128792,['机战'],233.0,2016/8/21,TRY Fighters作为测试驾驶员，受邀前往位于南方岛屿的尼尔森实验室，为矢岛企业测试新型对战系统。可是新系统出现了问题，结果要在住宿设施待命…当世海他们兴高采烈地待在有如度假村的住宿设施之时，出现在他们面前的是同样作为测试驾驶员而受到邀请的西亚、凑和强子三人。而等待着在南方岛屿再会的劲敌的，却是充满谜团的怪异事件…这会是TRY Fighters的最大危机！
此花亭奇谭（中配）,12,0,9.2,1,https://www.bilibili.com/bangumi/play/ss25379,2113859,87369,5640,5439,22877,2315650,25379,126192,"['萌系', '日常', '治愈', '漫画改']",594.0,2018/8/17,侍奉神明的狐娘们工作的温泉旅馆“此花亭”。“此花绮谭”便是来此花葶服务的新人服务员柚，和围绕着柚的伙伴们的暖人心怀的故事。服务员们想法只有一个。“不论真实身份是什么，不论是何等样人，客人就是神。”当然，现在在眼前的你也是……请接触柚她们的“招待”，来治愈疲惫的心吧。
偶像大师灰姑娘剧场 第三季（WEB版）,7,1,9.2,1,https://www.bilibili.com/bangumi/play/ss24961,535118,27423,1077,4016,573,459258,24961,113212,"['萌系', '偶像', '原创']",150.0,2018/7/3,熟悉的偶像们，今天也是非常地吵闹，包含平常未被描写的偶像们度过假期的方式，和偶像们的搞笑剧等丰富多彩内容的短篇动画，终于要开幕了。
